transaction_id,detail,merchant_id,status,created_at,updated_at
c3b8af74-2d35-4e9e-b6c7-8f8622b21d1b,dis parturient montes nascetur ridiculus mus vivamus vestibulum sagittis sapien cum sociis natoque penatibus,0f57bb0a-3cd6-47ec-ad95-111111111111,ACTIVE,2017-12-28 11:03:57,2017-12-30 05:02:44
4bdc301e-1ca7-4f03-bc0e-62a47dd93f65,consequat morbi a ipsum integer a nibh in quis justo maecenas rhoncus aliquam lacus morbi,0f57bb0a-3cd6-47ec-ad95-222222222222,ACTIVE,2017-12-21 04:17:17,2017-12-30 12:12:30
93f0d609-2ae2-4bea-903b-f34ad790b9ae,sagittis nam congue risus semper porta volutpat quam pede lobortis ligula sit amet,0f57bb0a-3cd6-47ec-ad95-111111111111,ACTIVE,2017-12-29 01:39:18,2017-12-28 22:40:30
7a9c6e1b-a570-4826-867d-1560089ace8d,primis in faucibus orci luctus et ultrices posuere cubilia curae donec pharetra magna,0f57bb0a-3cd6-47ec-ad95-222222222222,ACTIVE,2017-12-17 17:38:36,2017-12-22 14:19:28
ac7138a0-9f29-41ba-93f6-85a2bb169acc,nisl nunc rhoncus dui vel sem sed sagittis nam congue risus semper porta volutpat quam pede lobortis ligula sit amet,0f57bb0a-3cd6-47ec-ad95-111111111111,ACTIVE,2017-12-07 00:02:51,2017-12-29 02:31:18
f23fc9b9-2e0c-4bb9-aef5-64d9cf783ba8,quam pharetra magna ac consequat metus sapien ut nunc vestibulum ante ipsum primis in,0f57bb0a-3cd6-47ec-ad95-111111111111,ACTIVE,2017-12-10 07:32:51,2017-12-04 20:26:08
b2ddc767-9979-43c5-b6fe-b8a090a5b5db,dui vel nisl duis ac nibh fusce lacus purus aliquet at feugiat non pretium quis lectus suspendisse potenti in eleifend,0f57bb0a-3cd6-47ec-ad95-111111111111,ACTIVE,2017-12-29 13:20:17,2017-12-28 05:45:42
aa3b2f47-b5e6-4fd5-be70-c77e4e43cf04,nibh ligula nec sem duis aliquam convallis nunc proin at turpis,0f57bb0a-3cd6-47ec-ad95-111111111111,ACTIVE,2017-12-30 19:49:48,2017-12-30 02:07:04
e44d92cc-8433-4309-9711-ad4093d40c55,orci vehicula condimentum curabitur in libero ut massa volutpat convallis morbi odio odio elementum eu interdum eu tincidunt in leo,0f57bb0a-3cd6-47ec-ad95-222222222222,ACTIVE,2017-12-11 05:58:07,2017-12-23 11:33:01
92b10c54-ef1b-4884-b179-27301aba8f7a,elementum pellentesque quisque porta volutpat erat quisque erat eros viverra eget congue eget semper rutrum nulla,0f57bb0a-3cd6-47ec-ad95-111111111111,ACTIVE,2017-12-03 00:55:07,2017-12-19 05:36:27
12800082-34e2-4735-91a3-25935b585afc,ante ipsum primis in faucibus orci luctus et ultrices posuere cubilia curae donec pharetra magna vestibulum aliquet ultrices,0f57bb0a-3cd6-47ec-ad95-222222222222,ACTIVE,2017-12-19 21:22:13,2017-12-07 08:58:39
8ba5eb37-92b5-4b07-8ce8-3c59b0a9a911,turpis elementum ligula vehicula consequat morbi a ipsum integer a nibh in quis justo,0f57bb0a-3cd6-47ec-ad95-111111111111,ACTIVE,2017-12-05 21:34:45,2017-12-06 21:38:43
30f42d27-3ddb-42c8-b76d-9b08b69c41f8,in sagittis dui vel nisl duis ac nibh fusce lacus purus aliquet at feugiat non pretium quis lectus suspendisse,0f57bb0a-3cd6-47ec-ad95-111111111111,ACTIVE,2017-12-28 11:17:18,2017-12-15 11:55:40
39da2412-e487-4a9d-b963-249a94590f1f,velit eu est congue elementum in hac habitasse platea dictumst morbi vestibulum velit id pretium iaculis diam,0f57bb0a-3cd6-47ec-ad95-111111111111,ACTIVE,2017-12-06 08:37:11,2017-12-13 13:05:16
dc1e260f-f146-4913-81d7-d4bfb3df9c61,vestibulum velit id pretium iaculis diam erat fermentum justo nec condimentum neque sapien,0f57bb0a-3cd6-47ec-ad95-111111111111,ACTIVE,2017-12-16 14:30:48,2017-12-10 12:57:28
c981e8c8-1d78-432e-95b6-f1757ac4366a,pellentesque volutpat dui maecenas tristique est et tempus semper est quam,0f57bb0a-3cd6-47ec-ad95-111111111111,ACTIVE,2017-12-15 16:30:20,2017-12-16 10:28:19
7a177fc5-e302-45d0-80f8-93fb257a2a84,mattis odio donec vitae nisi nam ultrices libero non mattis pulvinar nulla pede ullamcorper augue a,0f57bb0a-3cd6-47ec-ad95-222222222222,ACTIVE,2017-12-12 23:15:51,2017-12-11 12:50:18
d40a8fed-7ba0-4e6a-95e5-9544073a17ee,dignissim vestibulum vestibulum ante ipsum primis in faucibus orci luctus et ultrices posuere cubilia curae,0f57bb0a-3cd6-47ec-ad95-222222222222,ACTIVE,2017-12-09 04:19:10,2017-12-10 21:21:38
403e2297-0333-48c3-b9e5-3fde2d01f06d,eu orci mauris lacinia sapien quis libero nullam sit amet turpis elementum ligula,0f57bb0a-3cd6-47ec-ad95-222222222222,ACTIVE,2017-12-27 08:23:12,2017-12-07 12:00:21
e90880dc-cf2f-4884-87e8-20fb378ba8fc,justo aliquam quis turpis eget elit sodales scelerisque mauris sit amet eros suspendisse,0f57bb0a-3cd6-47ec-ad95-222222222222,ACTIVE,2017-12-24 00:26:31,2017-12-29 22:03:57
8a830e11-80e4-40fd-8879-2a3ec900f3f7,tellus nisi eu orci mauris lacinia sapien quis libero nullam sit amet turpis elementum ligula vehicula,0f57bb0a-3cd6-47ec-ad95-222222222222,ACTIVE,2017-12-01 23:24:16,2017-12-03 07:14:13
a49a610f-d25d-43d3-ade4-465a0f2ac76d,ac tellus semper interdum mauris ullamcorper purus sit amet nulla quisque,0f57bb0a-3cd6-47ec-ad95-111111111111,ACTIVE,2017-12-15 06:25:28,2017-12-05 13:14:00
40631edc-62e4-48fa-b82a-dceefc3d93ea,in tempus sit amet sem fusce consequat nulla nisl nunc nisl duis bibendum,0f57bb0a-3cd6-47ec-ad95-222222222222,ACTIVE,2017-12-28 23:10:18,2017-12-13 02:22:23
c43e1891-8719-4492-8f3c-c87348465756,in lacus curabitur at ipsum ac tellus semper interdum mauris ullamcorper purus,0f57bb0a-3cd6-47ec-ad95-222222222222,ACTIVE,2017-12-12 20:12:51,2017-12-03 14:34:20
b69f4489-c1df-4f19-8a5d-6fff68792470,in sagittis dui vel nisl duis ac nibh fusce lacus purus aliquet at feugiat non,0f57bb0a-3cd6-47ec-ad95-222222222222,ACTIVE,2017-12-13 21:24:17,2017-12-21 07:15:24
f3d315f0-6488-4eaa-934b-7a6f6e7cde9f,nec nisi volutpat eleifend donec ut dolor morbi vel lectus,0f57bb0a-3cd6-47ec-ad95-222222222222,ACTIVE,2017-12-12 14:34:03,2017-12-11 13:35:08
cae95312-7702-4a2e-b63f-1c421a14d8cd,nec condimentum neque sapien placerat ante nulla justo aliquam quis turpis eget,0f57bb0a-3cd6-47ec-ad95-111111111111,ACTIVE,2017-12-14 23:27:55,2017-12-25 11:55:48
275eff4d-552a-480e-bab5-aa66f74c54f9,molestie sed justo pellentesque viverra pede ac diam cras pellentesque volutpat dui maecenas tristique,0f57bb0a-3cd6-47ec-ad95-111111111111,ACTIVE,2017-12-09 21:53:03,2017-12-13 16:22:15
9825ddeb-985b-42eb-ac79-66a59cc389a2,luctus nec molestie sed justo pellentesque viverra pede ac diam cras pellentesque volutpat dui maecenas tristique est,0f57bb0a-3cd6-47ec-ad95-222222222222,ACTIVE,2017-12-14 04:10:26,2017-12-07 09:09:26
67cb7f7b-23e3-4795-8474-c80d4f61b479,hac habitasse platea dictumst aliquam augue quam sollicitudin vitae consectetuer eget rutrum at lorem integer tincidunt ante vel ipsum praesent,0f57bb0a-3cd6-47ec-ad95-222222222222,ACTIVE,2017-12-06 23:35:54,2017-12-20 03:57:28
d1c40117-4e58-4b11-9d7c-ebea4b7f3efb,elit sodales scelerisque mauris sit amet eros suspendisse accumsan tortor,0f57bb0a-3cd6-47ec-ad95-111111111111,ACTIVE,2017-12-14 02:33:37,2017-12-26 04:42:48
e04ad997-ac42-419f-8076-f0c8311ad091,eget rutrum at lorem integer tincidunt ante vel ipsum praesent blandit lacinia,0f57bb0a-3cd6-47ec-ad95-111111111111,ACTIVE,2017-12-28 07:20:43,2017-12-10 12:26:49
29b69067-0444-4bf8-a43b-9bf492efd971,sapien quis libero nullam sit amet turpis elementum ligula vehicula consequat morbi a ipsum integer,0f57bb0a-3cd6-47ec-ad95-111111111111,ACTIVE,2017-12-16 07:26:37,2017-12-22 18:53:41
37f9998c-c101-4403-852f-9f371d86c9e8,pede ac diam cras pellentesque volutpat dui maecenas tristique est et tempus semper est quam pharetra,0f57bb0a-3cd6-47ec-ad95-111111111111,ACTIVE,2017-12-27 01:41:21,2017-12-17 00:17:13
f6fee89d-1e13-4038-a638-5765e1ae715d,diam vitae quam suspendisse potenti nullam porttitor lacus at turpis donec posuere metus vitae ipsum aliquam non mauris morbi non,0f57bb0a-3cd6-47ec-ad95-222222222222,ACTIVE,2017-12-06 00:15:13,2017-12-16 17:40:39
b1cd212d-b031-4559-bf6f-15645a23bffa,integer ac leo pellentesque ultrices mattis odio donec vitae nisi,0f57bb0a-3cd6-47ec-ad95-222222222222,ACTIVE,2017-12-01 03:58:12,2017-12-28 17:55:08
950321f2-58d1-4b3b-94ca-0ad8909ef1d6,tellus nisi eu orci mauris lacinia sapien quis libero nullam,0f57bb0a-3cd6-47ec-ad95-222222222222,ACTIVE,2017-12-25 08:44:26,2017-12-08 14:56:48
ab3c4637-f863-4816-aed2-0513824749eb,eros suspendisse accumsan tortor quis turpis sed ante vivamus tortor,0f57bb0a-3cd6-47ec-ad95-111111111111,ACTIVE,2017-12-10 04:24:44,2017-12-24 03:35:21
5be33da4-3c3f-40b9-b04a-5d00c85975e9,est donec odio justo sollicitudin ut suscipit a feugiat et,0f57bb0a-3cd6-47ec-ad95-222222222222,ACTIVE,2017-12-19 19:22:58,2017-12-09 13:20:03
230e465f-ab2b-45a8-b1bb-d73d65cb4296,arcu libero rutrum ac lobortis vel dapibus at diam nam tristique tortor eu,0f57bb0a-3cd6-47ec-ad95-111111111111,ACTIVE,2017-12-03 17:24:20,2017-12-22 19:53:53
a7148e10-9762-46fc-ba11-72604a0db531,diam vitae quam suspendisse potenti nullam porttitor lacus at turpis donec,0f57bb0a-3cd6-47ec-ad95-222222222222,ACTIVE,2017-12-15 15:20:44,2017-12-29 18:48:38
c892bddf-1327-4305-8d41-f2761acab4f6,luctus tincidunt nulla mollis molestie lorem quisque ut erat curabitur gravida nisi at nibh in hac habitasse platea dictumst aliquam,0f57bb0a-3cd6-47ec-ad95-222222222222,ACTIVE,2017-12-16 03:31:33,2017-12-15 16:58:49
642b8cbb-b48d-454b-8940-9a3f275737cd,amet justo morbi ut odio cras mi pede malesuada in imperdiet et commodo vulputate justo,0f57bb0a-3cd6-47ec-ad95-222222222222,ACTIVE,2017-12-15 04:27:20,2017-12-26 07:43:36
638c5d9e-9ef2-43c2-95a8-1a26e4778e98,placerat ante nulla justo aliquam quis turpis eget elit sodales scelerisque mauris sit amet eros suspendisse,0f57bb0a-3cd6-47ec-ad95-111111111111,ACTIVE,2017-12-05 21:50:15,2017-12-14 22:30:26
c915f00f-c7aa-419f-99dc-7aba721f2b87,vitae ipsum aliquam non mauris morbi non lectus aliquam sit amet diam in magna bibendum imperdiet nullam orci pede venenatis,0f57bb0a-3cd6-47ec-ad95-111111111111,ACTIVE,2017-12-14 15:57:16,2017-12-10 06:22:30
3a498ec0-81a5-46a1-a450-7014fd868931,erat fermentum justo nec condimentum neque sapien placerat ante nulla justo aliquam quis turpis eget,0f57bb0a-3cd6-47ec-ad95-111111111111,ACTIVE,2017-12-17 03:08:49,2017-12-14 06:17:32
9f2dea69-1512-4fa6-9058-9d450c22c097,cubilia curae mauris viverra diam vitae quam suspendisse potenti nullam porttitor lacus,0f57bb0a-3cd6-47ec-ad95-111111111111,ACTIVE,2017-12-10 05:14:08,2017-12-27 05:23:29
a3fd6136-dda8-4619-971a-b29af226b646,nec nisi vulputate nonummy maecenas tincidunt lacus at velit vivamus vel nulla eget eros elementum pellentesque quisque,0f57bb0a-3cd6-47ec-ad95-222222222222,ACTIVE,2017-12-09 09:00:31,2017-12-19 04:48:05
a90874bf-1be3-4aee-a751-38d53598a800,etiam vel augue vestibulum rutrum rutrum neque aenean auctor gravida sem praesent id massa id nisl venenatis,0f57bb0a-3cd6-47ec-ad95-111111111111,ACTIVE,2017-12-21 17:32:18,2017-12-04 07:17:03
ac192e54-1d6a-48fc-b87e-bc49115ecc15,volutpat eleifend donec ut dolor morbi vel lectus in quam fringilla rhoncus mauris enim leo rhoncus sed vestibulum,0f57bb0a-3cd6-47ec-ad95-111111111111,ACTIVE,2017-12-06 21:14:52,2017-12-24 13:11:10
ca8b09e2-f094-494b-a20b-7e4633331170,enim leo rhoncus sed vestibulum sit amet cursus id turpis integer,0f57bb0a-3cd6-47ec-ad95-111111111111,ACTIVE,2017-12-25 08:01:14,2017-12-19 21:54:33
a72fe945-ffba-4f6c-95e2-906d48471f1d,in faucibus orci luctus et ultrices posuere cubilia curae donec pharetra magna vestibulum aliquet ultrices erat tortor sollicitudin,0f57bb0a-3cd6-47ec-ad95-111111111111,ACTIVE,2017-12-17 03:11:31,2017-12-25 22:10:15
58f40f69-e9b1-456d-b685-d1873a616c2e,tincidunt ante vel ipsum praesent blandit lacinia erat vestibulum sed magna at nunc commodo placerat praesent blandit,0f57bb0a-3cd6-47ec-ad95-222222222222,ACTIVE,2017-12-02 11:02:33,2017-12-08 03:35:22
57581da5-6516-41e6-bc12-78571372bad1,sem fusce consequat nulla nisl nunc nisl duis bibendum felis sed interdum venenatis,0f57bb0a-3cd6-47ec-ad95-222222222222,ACTIVE,2017-12-22 21:37:12,2017-12-17 03:46:36
cbab36ea-fa39-46df-96b8-e5155f6f4007,faucibus orci luctus et ultrices posuere cubilia curae donec pharetra magna vestibulum aliquet ultrices erat tortor sollicitudin,0f57bb0a-3cd6-47ec-ad95-111111111111,ACTIVE,2017-12-03 13:21:53,2017-12-27 06:13:10
441be83f-0eb9-4d74-9869-cdb618fab18e,in blandit ultrices enim lorem ipsum dolor sit amet consectetuer adipiscing elit proin interdum mauris non ligula pellentesque ultrices,0f57bb0a-3cd6-47ec-ad95-222222222222,ACTIVE,2017-12-09 04:28:13,2017-12-24 17:08:50
c6b04bdc-0193-4ec4-9ff0-45e23c36d7f5,mauris sit amet eros suspendisse accumsan tortor quis turpis sed ante,0f57bb0a-3cd6-47ec-ad95-222222222222,ACTIVE,2017-12-02 08:45:02,2017-12-08 10:46:05
23fd776d-917c-4f89-9d7b-8e4cc5cfaae8,sed accumsan felis ut at dolor quis odio consequat varius integer ac leo pellentesque ultrices mattis odio,0f57bb0a-3cd6-47ec-ad95-111111111111,ACTIVE,2017-12-17 12:51:01,2017-12-13 20:41:16
9768cf58-55f7-4af8-a5bc-ca16e275db8a,nullam molestie nibh in lectus pellentesque at nulla suspendisse potenti cras in purus eu magna vulputate luctus,0f57bb0a-3cd6-47ec-ad95-222222222222,ACTIVE,2017-12-28 02:27:55,2017-12-17 21:39:48
8aba53a8-d1ef-42a7-89a4-1f102a0ee084,tristique fusce congue diam id ornare imperdiet sapien urna pretium,0f57bb0a-3cd6-47ec-ad95-222222222222,ACTIVE,2017-12-09 02:23:40,2017-12-23 02:18:04
edb51415-fb7f-450e-bb09-de3733405e36,ut volutpat sapien arcu sed augue aliquam erat volutpat in congue,0f57bb0a-3cd6-47ec-ad95-111111111111,ACTIVE,2017-12-17 20:07:33,2017-12-02 00:23:28
ce9faefc-de67-4303-9fee-744de1c85e4c,pede venenatis non sodales sed tincidunt eu felis fusce posuere,0f57bb0a-3cd6-47ec-ad95-222222222222,ACTIVE,2017-12-10 19:08:36,2017-12-18 18:17:34
1173b38a-a9ca-45db-b2a2-6714da08d3b6,eu magna vulputate luctus cum sociis natoque penatibus et magnis dis parturient montes nascetur ridiculus mus vivamus,0f57bb0a-3cd6-47ec-ad95-222222222222,ACTIVE,2017-12-08 12:33:24,2017-12-24 12:28:19
9eb3001f-befd-4f25-a58e-8b46f853f163,quis odio consequat varius integer ac leo pellentesque ultrices mattis odio donec vitae nisi nam ultrices libero non,0f57bb0a-3cd6-47ec-ad95-111111111111,ACTIVE,2017-12-16 13:12:34,2017-12-23 08:36:21
5ef7d66d-bb59-460c-a22c-e716b41a72b0,justo aliquam quis turpis eget elit sodales scelerisque mauris sit amet,0f57bb0a-3cd6-47ec-ad95-222222222222,ACTIVE,2017-12-23 15:33:48,2017-12-23 23:40:01
703c77db-756e-43cc-8745-52e4a493f788,quam fringilla rhoncus mauris enim leo rhoncus sed vestibulum sit amet cursus,0f57bb0a-3cd6-47ec-ad95-111111111111,ACTIVE,2017-12-24 22:38:09,2017-12-12 03:52:52
9050fe42-4dca-4eed-b9e3-31e4200ea3f0,velit eu est congue elementum in hac habitasse platea dictumst morbi vestibulum,0f57bb0a-3cd6-47ec-ad95-222222222222,ACTIVE,2017-12-01 01:01:16,2017-12-12 16:40:46
10d0d683-43a0-48f7-83db-ecf96df8aeef,quis orci eget orci vehicula condimentum curabitur in libero ut massa volutpat,0f57bb0a-3cd6-47ec-ad95-222222222222,ACTIVE,2017-12-06 16:27:30,2017-12-22 09:47:37
ffc05a53-3bef-49eb-bda6-332a1cd0637d,velit nec nisi vulputate nonummy maecenas tincidunt lacus at velit vivamus vel nulla eget eros elementum pellentesque quisque porta volutpat,0f57bb0a-3cd6-47ec-ad95-222222222222,ACTIVE,2017-12-28 01:45:08,2017-12-13 05:59:25
a1f5ccaa-cd6a-495e-9ff1-f509231e2ecf,vulputate nonummy maecenas tincidunt lacus at velit vivamus vel nulla eget eros elementum pellentesque quisque porta,0f57bb0a-3cd6-47ec-ad95-222222222222,ACTIVE,2017-12-10 18:22:35,2017-12-25 03:28:47
7dbec6dc-7248-4061-bdb4-f137ccff9544,molestie hendrerit at vulputate vitae nisl aenean lectus pellentesque eget nunc donec quis orci,0f57bb0a-3cd6-47ec-ad95-111111111111,ACTIVE,2017-12-16 21:08:33,2017-12-25 23:54:52
e2091077-7cf0-4aee-ad1b-6f9a7ccfb84f,est et tempus semper est quam pharetra magna ac consequat metus sapien ut nunc vestibulum ante ipsum,0f57bb0a-3cd6-47ec-ad95-111111111111,ACTIVE,2017-12-29 18:28:16,2017-12-09 14:30:09
f493a32b-06a9-43a6-b6df-7219a1673519,ut mauris eget massa tempor convallis nulla neque libero convallis eget eleifend luctus ultricies eu nibh quisque id,0f57bb0a-3cd6-47ec-ad95-222222222222,ACTIVE,2017-12-21 02:01:54,2017-12-30 02:40:16
9f65c05e-fc51-4a7f-b914-668fb3e38ef1,faucibus orci luctus et ultrices posuere cubilia curae duis faucibus accumsan odio curabitur convallis duis consequat dui nec,0f57bb0a-3cd6-47ec-ad95-111111111111,ACTIVE,2017-12-24 14:14:00,2017-12-14 03:10:51
6e2824db-bdec-4437-babb-0084b14918ea,ac enim in tempor turpis nec euismod scelerisque quam turpis adipiscing lorem vitae mattis nibh,0f57bb0a-3cd6-47ec-ad95-222222222222,ACTIVE,2017-12-11 13:34:40,2017-12-09 04:44:45
0d360974-060b-4be4-87fc-8b9963327f27,in tempor turpis nec euismod scelerisque quam turpis adipiscing lorem vitae mattis nibh ligula nec,0f57bb0a-3cd6-47ec-ad95-111111111111,ACTIVE,2017-12-21 12:46:33,2017-12-19 23:03:26
45ee0680-a66f-4043-868e-a578cb6e88ce,nisl nunc nisl duis bibendum felis sed interdum venenatis turpis enim blandit mi in porttitor,0f57bb0a-3cd6-47ec-ad95-111111111111,ACTIVE,2017-12-26 18:56:10,2017-12-30 13:58:29
349a70f0-90e6-444c-985e-31bfffe73af4,non velit donec diam neque vestibulum eget vulputate ut ultrices vel augue vestibulum ante ipsum primis in faucibus orci luctus,0f57bb0a-3cd6-47ec-ad95-222222222222,ACTIVE,2017-12-30 08:12:00,2017-12-20 09:01:31
a9da6a2c-0aab-4287-b5ad-b8826a0aebee,quis libero nullam sit amet turpis elementum ligula vehicula consequat,0f57bb0a-3cd6-47ec-ad95-111111111111,ACTIVE,2017-12-16 21:04:46,2017-12-20 02:19:12
4cf55391-3a30-4b67-be5e-1c575d99ae00,leo maecenas pulvinar lobortis est phasellus sit amet erat nulla,0f57bb0a-3cd6-47ec-ad95-222222222222,ACTIVE,2017-12-11 00:35:45,2017-12-22 14:39:25
fb979634-54ec-419e-a563-ea6fb830df2c,eget orci vehicula condimentum curabitur in libero ut massa volutpat convallis morbi odio odio elementum eu interdum eu,0f57bb0a-3cd6-47ec-ad95-222222222222,ACTIVE,2017-12-23 09:47:11,2017-12-19 14:41:47
20254a85-bc85-4831-a25d-ca051c0b2c15,est phasellus sit amet erat nulla tempus vivamus in felis eu,0f57bb0a-3cd6-47ec-ad95-111111111111,ACTIVE,2017-12-10 15:40:17,2017-12-14 02:01:29
0c18f022-5cd6-4ce1-b4c6-7c2211a17989,proin at turpis a pede posuere nonummy integer non velit donec diam neque vestibulum eget,0f57bb0a-3cd6-47ec-ad95-222222222222,ACTIVE,2017-12-23 23:58:51,2017-12-09 00:58:52
d56adb8c-c00e-4690-848e-42ea3a6720eb,vel enim sit amet nunc viverra dapibus nulla suscipit ligula in lacus,0f57bb0a-3cd6-47ec-ad95-222222222222,ACTIVE,2017-12-22 19:11:06,2017-12-28 20:28:01
d201b84e-5114-4032-a45a-564fd285ce74,augue aliquam erat volutpat in congue etiam justo etiam pretium iaculis justo,0f57bb0a-3cd6-47ec-ad95-222222222222,ACTIVE,2017-12-16 16:22:29,2017-12-07 20:55:29
3e458785-f00d-4da5-a793-978192ee2eb1,donec diam neque vestibulum eget vulputate ut ultrices vel augue vestibulum,0f57bb0a-3cd6-47ec-ad95-222222222222,ACTIVE,2017-12-04 18:53:13,2017-12-11 11:25:03
1edd94b3-2a7f-49d2-8a3e-ff76b69e36eb,cubilia curae duis faucibus accumsan odio curabitur convallis duis consequat dui nec,0f57bb0a-3cd6-47ec-ad95-222222222222,ACTIVE,2017-12-14 15:40:29,2017-12-11 10:40:05
1901eeeb-7ff9-4a6e-a3cb-8134fafe5bca,dolor sit amet consectetuer adipiscing elit proin interdum mauris non ligula pellentesque ultrices phasellus id sapien in sapien iaculis,0f57bb0a-3cd6-47ec-ad95-111111111111,ACTIVE,2017-12-20 15:55:02,2017-12-11 11:56:09
6d10687c-f53d-4d2d-8187-216baacbea64,mauris enim leo rhoncus sed vestibulum sit amet cursus id,0f57bb0a-3cd6-47ec-ad95-111111111111,ACTIVE,2017-12-16 19:42:20,2017-12-01 14:33:29
67c2cc67-93be-4510-b380-dec35467aa8f,habitasse platea dictumst etiam faucibus cursus urna ut tellus nulla ut erat id mauris vulputate elementum nullam varius,0f57bb0a-3cd6-47ec-ad95-111111111111,ACTIVE,2017-12-14 16:53:43,2017-12-04 08:08:34
4066fa66-8c14-4e2d-8d43-1b6a1eddc873,sed vel enim sit amet nunc viverra dapibus nulla suscipit ligula in lacus curabitur at ipsum ac tellus semper interdum,0f57bb0a-3cd6-47ec-ad95-111111111111,ACTIVE,2017-12-18 11:56:07,2017-12-07 18:08:39
3d6b4f69-b309-4163-975b-78a4db1c58f0,ligula vehicula consequat morbi a ipsum integer a nibh in quis justo maecenas rhoncus aliquam lacus,0f57bb0a-3cd6-47ec-ad95-222222222222,ACTIVE,2017-12-02 16:43:12,2017-12-12 16:27:34
45bdd197-03c3-4bd4-893c-34d2fb7a44f7,potenti nullam porttitor lacus at turpis donec posuere metus vitae ipsum aliquam non mauris morbi non lectus aliquam sit amet,0f57bb0a-3cd6-47ec-ad95-222222222222,ACTIVE,2017-12-08 00:30:25,2017-12-03 12:13:51
24b8b718-b3c6-4573-9293-d973be8a6514,eu magna vulputate luctus cum sociis natoque penatibus et magnis dis parturient montes nascetur ridiculus mus vivamus,0f57bb0a-3cd6-47ec-ad95-111111111111,ACTIVE,2017-12-08 22:50:43,2017-12-20 15:30:32
d9352a9b-0b16-43d6-9c15-2d1a354a916a,neque aenean auctor gravida sem praesent id massa id nisl venenatis lacinia aenean sit amet justo morbi ut odio,0f57bb0a-3cd6-47ec-ad95-222222222222,ACTIVE,2017-12-15 14:41:08,2017-12-21 17:40:53
f57b3ad4-ebe0-4358-98fa-d080c294d5b2,elementum pellentesque quisque porta volutpat erat quisque erat eros viverra eget congue eget semper rutrum nulla nunc purus phasellus in,0f57bb0a-3cd6-47ec-ad95-111111111111,ACTIVE,2017-12-17 17:46:55,2017-12-10 06:36:11
2c53d5d4-078d-4ce9-a55c-379ced55f8eb,ipsum primis in faucibus orci luctus et ultrices posuere cubilia curae mauris viverra,0f57bb0a-3cd6-47ec-ad95-111111111111,ACTIVE,2017-12-23 19:06:18,2017-12-28 06:32:44
d9fb3c06-9ff1-44a8-8cac-abfe3c53c2b3,nullam porttitor lacus at turpis donec posuere metus vitae ipsum aliquam non mauris morbi non lectus,0f57bb0a-3cd6-47ec-ad95-222222222222,ACTIVE,2017-12-03 10:56:41,2017-12-26 13:07:55
1b6371bd-4e6f-4445-90d5-4f5b85976d4a,posuere nonummy integer non velit donec diam neque vestibulum eget vulputate ut ultrices vel augue,0f57bb0a-3cd6-47ec-ad95-111111111111,ACTIVE,2017-12-02 03:25:03,2017-12-02 15:30:32
2c22a798-b54c-4a35-9c01-e9d3f32aafc2,augue vestibulum ante ipsum primis in faucibus orci luctus et ultrices posuere cubilia curae donec pharetra magna vestibulum aliquet,0f57bb0a-3cd6-47ec-ad95-111111111111,ACTIVE,2017-12-19 23:31:40,2017-12-18 23:19:48
9119e0e3-f60d-4e3a-98f5-6f951abcf803,volutpat in congue etiam justo etiam pretium iaculis justo in hac habitasse platea dictumst etiam,0f57bb0a-3cd6-47ec-ad95-111111111111,ACTIVE,2017-12-23 09:58:55,2017-12-30 06:54:16
ba59d094-3ff2-4b3c-b936-c286160f214b,curabitur at ipsum ac tellus semper interdum mauris ullamcorper purus,0f57bb0a-3cd6-47ec-ad95-222222222222,ACTIVE,2017-12-26 08:09:11,2017-12-23 19:53:46
a1f8ee94-898a-4bc5-835a-3e151d6a0d29,semper rutrum nulla nunc purus phasellus in felis donec semper sapien a,0f57bb0a-3cd6-47ec-ad95-111111111111,ACTIVE,2017-12-24 10:03:07,2017-12-06 22:28:59
52b73765-ede8-4f01-8604-c9b2517375ee,eget eros elementum pellentesque quisque porta volutpat erat quisque erat eros viverra eget congue eget semper rutrum,0f57bb0a-3cd6-47ec-ad95-111111111111,ACTIVE,2017-12-20 14:03:31,2017-12-14 12:27:37
d0e0c985-7918-45af-992a-8b004d5d5fc6,consequat varius integer ac leo pellentesque ultrices mattis odio donec vitae nisi nam ultrices libero non mattis pulvinar nulla,0f57bb0a-3cd6-47ec-ad95-222222222222,ACTIVE,2017-12-04 12:34:15,2017-12-29 10:16:11
cff83d18-ac64-459a-8c1a-820023359fc5,at feugiat non pretium quis lectus suspendisse potenti in eleifend quam a,0f57bb0a-3cd6-47ec-ad95-111111111111,ACTIVE,2017-12-13 13:50:04,2017-12-25 19:00:01
4f66cd2c-48cf-4fe3-a40c-32574d2c5f48,venenatis lacinia aenean sit amet justo morbi ut odio cras mi pede malesuada in imperdiet et commodo,0f57bb0a-3cd6-47ec-ad95-111111111111,ACTIVE,2017-12-19 13:19:42,2017-12-15 18:19:10
16b9d7ec-4636-4db1-bb96-3cf0a4299f85,primis in faucibus orci luctus et ultrices posuere cubilia curae mauris viverra diam vitae quam suspendisse potenti nullam porttitor lacus,0f57bb0a-3cd6-47ec-ad95-222222222222,ACTIVE,2017-12-15 15:56:47,2017-12-16 20:25:11
46f8dc26-e1f1-41a1-adfd-7640f795f800,diam neque vestibulum eget vulputate ut ultrices vel augue vestibulum ante,0f57bb0a-3cd6-47ec-ad95-222222222222,ACTIVE,2017-12-29 08:03:41,2017-12-14 13:17:10
a0062c48-dcef-416b-81fc-4cccaca3d77c,molestie nibh in lectus pellentesque at nulla suspendisse potenti cras,0f57bb0a-3cd6-47ec-ad95-111111111111,ACTIVE,2017-12-06 21:43:00,2017-12-12 19:06:33
d516d99c-97f8-4cfa-b222-0785f8da60f9,sed justo pellentesque viverra pede ac diam cras pellentesque volutpat dui maecenas tristique est et tempus semper est quam,0f57bb0a-3cd6-47ec-ad95-111111111111,ACTIVE,2017-12-06 02:19:52,2017-12-13 01:43:56
955b6944-050d-4e75-9739-a70dd4166eaf,risus praesent lectus vestibulum quam sapien varius ut blandit non interdum in ante vestibulum ante ipsum primis in faucibus orci,0f57bb0a-3cd6-47ec-ad95-222222222222,ACTIVE,2017-12-24 03:36:39,2017-12-13 11:29:17
0d3ab224-dc16-46cf-930d-9e56f78fc5e5,vestibulum ante ipsum primis in faucibus orci luctus et ultrices posuere,0f57bb0a-3cd6-47ec-ad95-222222222222,ACTIVE,2017-12-10 15:56:41,2017-12-07 10:26:37
ab45b965-c4bd-414e-95bd-6645c83556d1,at dolor quis odio consequat varius integer ac leo pellentesque ultrices mattis odio donec vitae,0f57bb0a-3cd6-47ec-ad95-222222222222,ACTIVE,2017-12-16 23:56:17,2017-12-30 08:09:40
31a8a2de-068a-473d-ab04-8aca89973e04,odio condimentum id luctus nec molestie sed justo pellentesque viverra pede ac diam cras pellentesque volutpat dui maecenas tristique est,0f57bb0a-3cd6-47ec-ad95-222222222222,ACTIVE,2017-12-02 20:55:23,2017-12-09 07:05:41
c10000a7-3c57-4dd0-9b1e-024974f71b93,venenatis lacinia aenean sit amet justo morbi ut odio cras mi,0f57bb0a-3cd6-47ec-ad95-222222222222,ACTIVE,2017-12-23 08:32:17,2017-12-17 22:32:02
44c439c1-a7bd-4bc1-bf5a-74124cf821f9,ante vestibulum ante ipsum primis in faucibus orci luctus et ultrices posuere cubilia curae duis faucibus,0f57bb0a-3cd6-47ec-ad95-111111111111,ACTIVE,2017-12-07 15:13:12,2017-12-28 22:15:27
