transaction_id,detail,merchant_id,status,created_at,updated_at
14bdfccf-436a-480f-874a-5d1026bcad87,facilisi cras non velit nec nisi vulputate nonummy maecenas tincidunt lacus at velit vivamus vel nulla eget,0f57bb0a-3cd6-47ec-ad95-222222222222,ACTIVE,2017-12-01 09:59:34,2017-12-23 11:19:06
29599754-09bb-4fea-9944-57de52d53200,fusce congue diam id ornare imperdiet sapien urna pretium nisl ut volutpat sapien arcu sed augue aliquam erat volutpat,0f57bb0a-3cd6-47ec-ad95-111111111111,ACTIVE,2017-12-24 10:14:48,2017-12-23 07:37:35
10456795-fb5f-4c12-8ca6-40e1b4a6a8bf,phasellus id sapien in sapien iaculis congue vivamus metus arcu,0f57bb0a-3cd6-47ec-ad95-111111111111,ACTIVE,2017-12-30 00:16:52,2017-12-21 04:58:31
e8698e7f-f9fd-4322-9e39-f529d29a5253,vulputate elementum nullam varius nulla facilisi cras non velit nec nisi vulputate nonummy maecenas,0f57bb0a-3cd6-47ec-ad95-222222222222,ACTIVE,2017-12-03 23:02:42,2017-12-04 01:07:22
40c10040-32fe-4d44-ac74-35feeef1292a,blandit non interdum in ante vestibulum ante ipsum primis in faucibus orci luctus et ultrices,0f57bb0a-3cd6-47ec-ad95-111111111111,ACTIVE,2017-12-25 13:46:13,2017-12-18 16:45:59
780fd97d-9ab3-4328-8b80-6d328aee0a0a,neque duis bibendum morbi non quam nec dui luctus rutrum nulla tellus in sagittis,0f57bb0a-3cd6-47ec-ad95-111111111111,ACTIVE,2017-12-16 17:24:23,2017-12-24 17:08:14
3ae2c987-80c5-4545-a365-6fdc9208177d,justo pellentesque viverra pede ac diam cras pellentesque volutpat dui maecenas tristique est et tempus semper est quam,0f57bb0a-3cd6-47ec-ad95-111111111111,ACTIVE,2017-12-10 05:54:20,2017-12-07 12:49:42
66afe8e4-e4b7-400d-9076-3c9e81d9a6b0,aenean fermentum donec ut mauris eget massa tempor convallis nulla neque libero convallis eget eleifend luctus,0f57bb0a-3cd6-47ec-ad95-111111111111,ACTIVE,2017-12-29 19:16:08,2017-12-11 13:26:29
b6f825c7-5214-48d4-8e4a-80d62ace8b07,ut odio cras mi pede malesuada in imperdiet et commodo vulputate justo,0f57bb0a-3cd6-47ec-ad95-111111111111,ACTIVE,2017-12-23 14:03:36,2017-12-23 05:37:55
b81a653d-1f28-44b6-83be-35ffabcd9556,dui proin leo odio porttitor id consequat in consequat ut nulla sed accumsan felis ut at,0f57bb0a-3cd6-47ec-ad95-111111111111,ACTIVE,2017-12-21 13:13:52,2017-12-16 01:30:29
5142cc0e-a6a9-452c-b9ed-08bb702f59fa,felis sed lacus morbi sem mauris laoreet ut rhoncus aliquet pulvinar sed nisl nunc rhoncus dui vel,0f57bb0a-3cd6-47ec-ad95-111111111111,ACTIVE,2017-12-22 03:55:55,2017-12-12 21:26:43
4a1997df-25e2-453e-9cc7-17e3a87ef60f,orci mauris lacinia sapien quis libero nullam sit amet turpis elementum ligula vehicula consequat,0f57bb0a-3cd6-47ec-ad95-222222222222,ACTIVE,2017-12-09 17:42:08,2017-12-27 03:51:06
d35fe25b-49f7-49df-9850-16e36c979a37,ut rhoncus aliquet pulvinar sed nisl nunc rhoncus dui vel sem sed sagittis nam,0f57bb0a-3cd6-47ec-ad95-111111111111,ACTIVE,2017-12-10 18:25:52,2017-12-25 22:48:45
5ba4f70e-7489-4943-babd-ad377daa8cd0,eu orci mauris lacinia sapien quis libero nullam sit amet turpis elementum ligula vehicula,0f57bb0a-3cd6-47ec-ad95-222222222222,ACTIVE,2017-12-21 21:35:26,2017-12-21 05:02:03
d6828f00-a7ad-413e-b9f0-ddc105dae9a5,enim lorem ipsum dolor sit amet consectetuer adipiscing elit proin interdum mauris non ligula pellentesque ultrices,0f57bb0a-3cd6-47ec-ad95-111111111111,ACTIVE,2017-12-09 23:50:46,2017-12-22 00:02:40
fe2c54a0-628f-41c6-ab91-565f825756b8,hac habitasse platea dictumst aliquam augue quam sollicitudin vitae consectetuer eget rutrum,0f57bb0a-3cd6-47ec-ad95-222222222222,ACTIVE,2017-12-17 18:08:21,2017-12-01 14:03:32
d51e9a9a-09c4-4bf3-bdf4-7b95f3527a4b,non ligula pellentesque ultrices phasellus id sapien in sapien iaculis congue vivamus metus arcu adipiscing,0f57bb0a-3cd6-47ec-ad95-111111111111,ACTIVE,2017-12-23 22:09:08,2017-12-21 08:08:22
bf587097-21b4-4f61-827d-daa3228b5542,est risus auctor sed tristique in tempus sit amet sem fusce consequat nulla,0f57bb0a-3cd6-47ec-ad95-111111111111,ACTIVE,2017-12-17 16:42:49,2017-12-02 18:49:39
f1dead67-f10c-4a9b-b84f-8eefc7f66c9e,convallis morbi odio odio elementum eu interdum eu tincidunt in leo maecenas pulvinar lobortis est phasellus,0f57bb0a-3cd6-47ec-ad95-111111111111,ACTIVE,2017-12-20 12:36:05,2017-12-16 13:58:42
32ec4548-39b4-4a75-ad75-fbf3eae3b977,turpis sed ante vivamus tortor duis mattis egestas metus aenean fermentum donec ut,0f57bb0a-3cd6-47ec-ad95-111111111111,ACTIVE,2017-12-07 06:45:18,2017-12-05 05:16:53
7256c1c1-c01d-4b6f-8728-69628d3cd26a,dis parturient montes nascetur ridiculus mus etiam vel augue vestibulum rutrum rutrum neque aenean auctor gravida sem praesent id massa,0f57bb0a-3cd6-47ec-ad95-111111111111,ACTIVE,2017-12-04 13:23:59,2017-12-05 01:06:01
0850c9b8-4447-420a-96c7-b80f9e85fac5,at vulputate vitae nisl aenean lectus pellentesque eget nunc donec quis orci eget orci vehicula condimentum curabitur in,0f57bb0a-3cd6-47ec-ad95-222222222222,ACTIVE,2017-12-26 21:01:08,2017-12-08 10:41:29
43b79a06-cb48-460a-ac52-660b714cdab7,velit eu est congue elementum in hac habitasse platea dictumst morbi vestibulum velit id pretium iaculis diam erat,0f57bb0a-3cd6-47ec-ad95-222222222222,ACTIVE,2017-12-26 11:45:03,2017-12-29 05:35:20
3c4a16ae-6e1f-4a06-9df1-3a6050e14ebc,nunc proin at turpis a pede posuere nonummy integer non velit donec diam neque vestibulum eget vulputate ut ultrices,0f57bb0a-3cd6-47ec-ad95-111111111111,ACTIVE,2017-12-01 06:19:49,2017-12-12 15:05:45
8ef8567c-1923-41fe-b861-8b24d39803d7,in faucibus orci luctus et ultrices posuere cubilia curae mauris viverra diam vitae quam suspendisse potenti nullam,0f57bb0a-3cd6-47ec-ad95-111111111111,ACTIVE,2017-12-18 20:46:13,2017-12-09 18:17:23
f085e3f3-4ba6-4d61-93ac-9d8c29daaf2b,lorem ipsum dolor sit amet consectetuer adipiscing elit proin risus praesent lectus vestibulum,0f57bb0a-3cd6-47ec-ad95-111111111111,ACTIVE,2017-12-07 23:21:26,2017-12-05 02:28:43
d167dc46-ed4c-4419-bb2e-040987473e74,porttitor pede justo eu massa donec dapibus duis at velit eu est congue elementum in hac habitasse platea dictumst morbi,0f57bb0a-3cd6-47ec-ad95-111111111111,ACTIVE,2017-12-01 20:07:40,2017-12-28 16:35:17
51001393-c9b8-4d39-98d2-217b2db2459a,enim in tempor turpis nec euismod scelerisque quam turpis adipiscing lorem,0f57bb0a-3cd6-47ec-ad95-111111111111,ACTIVE,2017-12-28 12:10:36,2017-12-13 16:06:10
53e9c3d5-26e5-4c09-a0a8-52ff85f79893,sollicitudin mi sit amet lobortis sapien sapien non mi integer ac neque duis bibendum,0f57bb0a-3cd6-47ec-ad95-111111111111,ACTIVE,2017-12-28 22:48:25,2017-12-19 23:31:53
2cfd07e6-db45-41a1-8674-9712f70b2748,nunc purus phasellus in felis donec semper sapien a libero nam dui proin leo,0f57bb0a-3cd6-47ec-ad95-111111111111,ACTIVE,2017-12-27 03:36:55,2017-12-28 05:50:05
7ed0e6bd-023f-43b0-b235-81d8f98ef445,eu orci mauris lacinia sapien quis libero nullam sit amet turpis elementum,0f57bb0a-3cd6-47ec-ad95-222222222222,ACTIVE,2017-12-18 10:05:42,2017-12-04 08:05:51
0b795d2e-f1be-43bc-871c-5c4d4c6ca7f4,amet nunc viverra dapibus nulla suscipit ligula in lacus curabitur,0f57bb0a-3cd6-47ec-ad95-111111111111,ACTIVE,2017-12-16 00:07:52,2017-12-12 17:05:19
1a106bc4-37c1-47d4-95ae-0f8ffa7b965a,turpis sed ante vivamus tortor duis mattis egestas metus aenean fermentum donec ut,0f57bb0a-3cd6-47ec-ad95-111111111111,ACTIVE,2017-12-09 16:44:08,2017-12-30 16:15:18
e7fd6969-bcc9-4d78-b833-d85f36e3f2d0,justo maecenas rhoncus aliquam lacus morbi quis tortor id nulla ultrices aliquet maecenas leo odio,0f57bb0a-3cd6-47ec-ad95-222222222222,ACTIVE,2017-12-28 01:37:56,2017-12-09 21:56:05
d313fa3b-20d4-4f29-996a-48242ccdf2ea,quisque id justo sit amet sapien dignissim vestibulum vestibulum ante ipsum primis in faucibus orci luctus et ultrices posuere,0f57bb0a-3cd6-47ec-ad95-222222222222,ACTIVE,2017-12-14 17:43:33,2017-12-13 05:19:14
a06eec89-389a-4c1b-9083-8f39ad78635a,sit amet lobortis sapien sapien non mi integer ac neque,0f57bb0a-3cd6-47ec-ad95-222222222222,ACTIVE,2017-12-23 16:51:15,2017-12-12 09:28:22
8abc01cf-456b-4545-af83-9b69cf0c91e9,cum sociis natoque penatibus et magnis dis parturient montes nascetur ridiculus mus vivamus vestibulum,0f57bb0a-3cd6-47ec-ad95-222222222222,ACTIVE,2017-12-25 05:07:19,2017-12-09 13:44:02
e15a4949-3ff8-49af-9428-28b1ff850315,curabitur gravida nisi at nibh in hac habitasse platea dictumst aliquam augue quam sollicitudin vitae consectetuer eget rutrum at,0f57bb0a-3cd6-47ec-ad95-222222222222,ACTIVE,2017-12-18 18:02:59,2017-12-29 09:47:19
b233c766-3234-49c9-9ebf-ed6792512869,a nibh in quis justo maecenas rhoncus aliquam lacus morbi quis tortor id nulla ultrices aliquet maecenas leo odio,0f57bb0a-3cd6-47ec-ad95-222222222222,ACTIVE,2017-12-01 03:18:40,2017-12-09 09:55:36
79305a4f-1f6e-4046-8631-bc2f301926f9,magna ac consequat metus sapien ut nunc vestibulum ante ipsum,0f57bb0a-3cd6-47ec-ad95-222222222222,ACTIVE,2017-12-25 14:47:27,2017-12-02 13:42:12
e33e1f5e-0e9c-4e4b-a543-23dcef509a73,luctus cum sociis natoque penatibus et magnis dis parturient montes nascetur ridiculus mus vivamus vestibulum sagittis,0f57bb0a-3cd6-47ec-ad95-111111111111,ACTIVE,2017-12-01 05:53:11,2017-12-05 01:47:30
9201cd64-26bd-4897-baf8-f0540dc49075,proin eu mi nulla ac enim in tempor turpis nec euismod scelerisque quam turpis adipiscing,0f57bb0a-3cd6-47ec-ad95-111111111111,ACTIVE,2017-12-02 21:20:29,2017-12-11 01:36:12
e11bf088-bc6c-4829-b496-65d682301e07,augue luctus tincidunt nulla mollis molestie lorem quisque ut erat curabitur gravida nisi at nibh in hac habitasse platea,0f57bb0a-3cd6-47ec-ad95-111111111111,ACTIVE,2017-12-04 05:07:20,2017-12-18 06:50:44
695564a8-1497-4cf6-ad34-4ba41d424ba9,aenean auctor gravida sem praesent id massa id nisl venenatis,0f57bb0a-3cd6-47ec-ad95-222222222222,ACTIVE,2017-12-18 01:22:08,2017-12-12 11:34:46
21084586-1d62-4633-81bd-0f0b6067a4bf,odio cras mi pede malesuada in imperdiet et commodo vulputate justo in blandit ultrices enim lorem ipsum,0f57bb0a-3cd6-47ec-ad95-111111111111,ACTIVE,2017-12-16 06:09:18,2017-12-11 08:50:47
e2c17fd6-7e54-4885-a5e3-5cde7e161a23,ultrices enim lorem ipsum dolor sit amet consectetuer adipiscing elit proin interdum,0f57bb0a-3cd6-47ec-ad95-111111111111,ACTIVE,2017-12-16 10:22:29,2017-12-29 07:24:27
f1d33445-0e5c-4a3c-b8b3-b28c7e5143a4,cubilia curae donec pharetra magna vestibulum aliquet ultrices erat tortor sollicitudin mi sit amet lobortis sapien sapien non,0f57bb0a-3cd6-47ec-ad95-111111111111,ACTIVE,2017-12-16 08:06:19,2017-12-07 03:02:49
889f219f-9adb-47d4-96d3-91e59ad31c3a,nulla quisque arcu libero rutrum ac lobortis vel dapibus at diam nam tristique tortor eu pede,0f57bb0a-3cd6-47ec-ad95-111111111111,ACTIVE,2017-12-12 13:27:31,2017-12-22 10:21:42
e5d2763d-8068-4ff4-947a-f47407220888,volutpat convallis morbi odio odio elementum eu interdum eu tincidunt in leo maecenas pulvinar lobortis est,0f57bb0a-3cd6-47ec-ad95-111111111111,ACTIVE,2017-12-17 03:17:25,2017-12-13 10:24:59
06096a0e-b6f8-46e8-bed5-552ca3720411,at nunc commodo placerat praesent blandit nam nulla integer pede justo lacinia eget tincidunt eget tempus vel pede morbi porttitor,0f57bb0a-3cd6-47ec-ad95-111111111111,ACTIVE,2017-12-23 18:27:56,2017-12-28 22:09:31
e07f72b4-096d-49f4-9c01-e9456ce62273,felis sed lacus morbi sem mauris laoreet ut rhoncus aliquet pulvinar sed,0f57bb0a-3cd6-47ec-ad95-222222222222,ACTIVE,2017-12-28 19:42:35,2017-12-14 13:52:54
5af4b40b-c0de-4359-b187-d0864b656ccd,imperdiet et commodo vulputate justo in blandit ultrices enim lorem ipsum dolor,0f57bb0a-3cd6-47ec-ad95-222222222222,ACTIVE,2017-12-15 15:45:28,2017-12-06 13:07:12
cf7446b9-b7a5-4dac-988e-3b82edcdf585,ornare imperdiet sapien urna pretium nisl ut volutpat sapien arcu sed augue aliquam erat volutpat in congue,0f57bb0a-3cd6-47ec-ad95-111111111111,ACTIVE,2017-12-13 14:39:00,2017-12-21 00:19:32
0adb165d-be0e-437a-8382-54f9ff9bbbda,aenean sit amet justo morbi ut odio cras mi pede malesuada in imperdiet,0f57bb0a-3cd6-47ec-ad95-222222222222,ACTIVE,2017-12-18 21:48:55,2017-12-10 13:49:31
7b5b5f9f-c2d3-4c37-bfaf-1cfbc220b9f1,vulputate elementum nullam varius nulla facilisi cras non velit nec nisi,0f57bb0a-3cd6-47ec-ad95-111111111111,ACTIVE,2017-12-13 15:32:41,2017-12-24 10:34:09
f2db69a6-0469-4d41-88b3-d2efe69b5d53,ligula pellentesque ultrices phasellus id sapien in sapien iaculis congue,0f57bb0a-3cd6-47ec-ad95-111111111111,ACTIVE,2017-12-06 06:18:29,2017-12-28 05:04:30
5faeb732-98b2-405d-b081-2fb129b67fbf,non mattis pulvinar nulla pede ullamcorper augue a suscipit nulla elit ac nulla sed,0f57bb0a-3cd6-47ec-ad95-111111111111,ACTIVE,2017-12-11 20:26:29,2017-12-12 20:42:14
b7d04a76-0120-4fda-8eae-c03e601f11df,sapien a libero nam dui proin leo odio porttitor id consequat in consequat,0f57bb0a-3cd6-47ec-ad95-222222222222,ACTIVE,2017-12-07 17:11:20,2017-12-18 04:19:12
da0f27fb-d59b-4292-a6ee-6d0b4821d501,sapien cursus vestibulum proin eu mi nulla ac enim in tempor turpis nec euismod scelerisque,0f57bb0a-3cd6-47ec-ad95-222222222222,ACTIVE,2017-12-30 07:52:46,2017-12-14 13:56:36
b5b11227-101a-44fa-8039-9be03449c9e0,est congue elementum in hac habitasse platea dictumst morbi vestibulum velit id pretium iaculis diam erat fermentum,0f57bb0a-3cd6-47ec-ad95-222222222222,ACTIVE,2017-12-01 20:19:10,2017-12-08 18:25:05
7a1cdee5-53cc-43a8-9e12-fc50f5e93ac7,non velit donec diam neque vestibulum eget vulputate ut ultrices vel augue vestibulum ante ipsum primis in faucibus,0f57bb0a-3cd6-47ec-ad95-111111111111,ACTIVE,2017-12-14 22:09:21,2017-12-14 00:26:00
e319fe18-06cc-4507-b033-eab0e475e90e,mauris non ligula pellentesque ultrices phasellus id sapien in sapien iaculis congue,0f57bb0a-3cd6-47ec-ad95-222222222222,ACTIVE,2017-12-17 09:57:13,2017-12-28 13:47:54
7c6062fd-c4c1-4748-a1b2-c534d901950f,fusce congue diam id ornare imperdiet sapien urna pretium nisl ut volutpat sapien,0f57bb0a-3cd6-47ec-ad95-111111111111,ACTIVE,2017-12-03 18:54:00,2017-12-10 08:27:40
b7938d88-f41e-4981-a28f-55b1699dbc76,vehicula consequat morbi a ipsum integer a nibh in quis justo maecenas rhoncus aliquam lacus morbi quis tortor,0f57bb0a-3cd6-47ec-ad95-111111111111,ACTIVE,2017-12-15 10:08:18,2017-12-06 15:31:08
d88b3146-abc9-4d07-b7aa-1b9e6b6738af,in porttitor pede justo eu massa donec dapibus duis at velit eu est congue,0f57bb0a-3cd6-47ec-ad95-222222222222,ACTIVE,2017-12-30 19:11:28,2017-12-17 11:24:26
8de5a769-f03c-49a3-9aec-cd8c25f99529,eros vestibulum ac est lacinia nisi venenatis tristique fusce congue diam id ornare imperdiet sapien urna pretium nisl,0f57bb0a-3cd6-47ec-ad95-222222222222,ACTIVE,2017-12-04 21:45:07,2017-12-23 10:27:27
2d18ad22-76aa-4a6b-a2bc-1e6d5d0f461b,sem sed sagittis nam congue risus semper porta volutpat quam pede lobortis ligula sit amet eleifend,0f57bb0a-3cd6-47ec-ad95-222222222222,ACTIVE,2017-12-17 00:45:40,2017-12-25 12:09:26
bc929217-fbe0-42ba-ba97-51e8d2407ce2,eget tempus vel pede morbi porttitor lorem id ligula suspendisse ornare consequat lectus in est,0f57bb0a-3cd6-47ec-ad95-222222222222,ACTIVE,2017-12-28 15:14:02,2017-12-06 22:48:38
1811f806-c7e6-4b55-8c14-2b2af5acf5d2,rutrum nulla tellus in sagittis dui vel nisl duis ac nibh fusce lacus,0f57bb0a-3cd6-47ec-ad95-222222222222,ACTIVE,2017-12-03 01:51:22,2017-12-13 06:10:37
de62ed91-121e-45e9-b2dd-6505464887a6,porttitor lacus at turpis donec posuere metus vitae ipsum aliquam non mauris morbi non lectus aliquam sit,0f57bb0a-3cd6-47ec-ad95-111111111111,ACTIVE,2017-12-29 03:54:58,2017-12-14 16:16:08
d9c72946-87cf-4123-ba1c-1c4e3ece1747,mauris laoreet ut rhoncus aliquet pulvinar sed nisl nunc rhoncus dui vel sem sed sagittis nam congue risus,0f57bb0a-3cd6-47ec-ad95-111111111111,ACTIVE,2017-12-02 05:38:33,2017-12-26 08:24:21
2ee90348-64e9-4682-bda3-c197d89a3d03,curae nulla dapibus dolor vel est donec odio justo sollicitudin ut suscipit a feugiat et,0f57bb0a-3cd6-47ec-ad95-222222222222,ACTIVE,2017-12-18 07:26:51,2017-12-17 01:42:28
608ccac7-0cc1-4b2f-b3e2-ca21f8dd8f95,ullamcorper purus sit amet nulla quisque arcu libero rutrum ac lobortis vel dapibus,0f57bb0a-3cd6-47ec-ad95-222222222222,ACTIVE,2017-12-12 12:06:42,2017-12-08 23:41:41
01a634d5-cee7-4686-8771-f71d7c9ca01b,nullam varius nulla facilisi cras non velit nec nisi vulputate nonummy maecenas tincidunt lacus at,0f57bb0a-3cd6-47ec-ad95-111111111111,ACTIVE,2017-12-18 21:46:57,2017-12-19 12:43:03
b1bbaa12-5a24-4d92-bacb-e4b629a2c31d,orci luctus et ultrices posuere cubilia curae nulla dapibus dolor vel est donec odio justo sollicitudin ut suscipit a feugiat,0f57bb0a-3cd6-47ec-ad95-222222222222,ACTIVE,2017-12-03 13:53:46,2017-12-04 20:50:51
8400dd36-9fa4-4b77-b98c-403c4d1893ed,non mi integer ac neque duis bibendum morbi non quam nec dui luctus rutrum nulla tellus in sagittis,0f57bb0a-3cd6-47ec-ad95-111111111111,ACTIVE,2017-12-17 23:26:32,2017-12-14 11:38:41
bd55e464-d0da-4f1e-a6ad-9a3595edd31a,eros elementum pellentesque quisque porta volutpat erat quisque erat eros viverra eget congue eget semper rutrum nulla nunc purus,0f57bb0a-3cd6-47ec-ad95-222222222222,ACTIVE,2017-12-27 17:28:58,2017-12-24 01:50:34
8447ba3d-c30e-4896-8223-463a7eee20b6,hac habitasse platea dictumst morbi vestibulum velit id pretium iaculis diam erat fermentum,0f57bb0a-3cd6-47ec-ad95-111111111111,ACTIVE,2017-12-16 13:00:24,2017-12-24 14:54:59
f588dfd1-4b9c-40b6-baf7-d029f96971f2,amet eros suspendisse accumsan tortor quis turpis sed ante vivamus tortor duis mattis,0f57bb0a-3cd6-47ec-ad95-111111111111,ACTIVE,2017-12-03 21:01:48,2017-12-05 15:22:19
892638f2-6e19-4ab6-92c1-dba19dfb6509,a nibh in quis justo maecenas rhoncus aliquam lacus morbi quis tortor id nulla ultrices,0f57bb0a-3cd6-47ec-ad95-222222222222,ACTIVE,2017-12-06 02:00:19,2017-12-22 13:42:51
227517d6-db77-40bc-80c4-47fb5fadd913,arcu adipiscing molestie hendrerit at vulputate vitae nisl aenean lectus pellentesque,0f57bb0a-3cd6-47ec-ad95-222222222222,ACTIVE,2017-12-23 07:00:24,2017-12-05 10:03:07
95405517-18a9-4f98-98c3-469e6f72c95d,praesent blandit lacinia erat vestibulum sed magna at nunc commodo placerat praesent blandit nam nulla integer pede justo lacinia,0f57bb0a-3cd6-47ec-ad95-111111111111,ACTIVE,2017-12-12 20:20:47,2017-12-26 18:11:10
134433b3-00d2-4e3d-8a02-788d497a0ad5,dui maecenas tristique est et tempus semper est quam pharetra magna ac consequat metus sapien ut nunc vestibulum ante,0f57bb0a-3cd6-47ec-ad95-111111111111,ACTIVE,2017-12-22 13:31:58,2017-12-26 21:45:47
e05876d8-40d6-4e0d-afda-119c8186e7ce,pede justo eu massa donec dapibus duis at velit eu est congue,0f57bb0a-3cd6-47ec-ad95-222222222222,ACTIVE,2017-12-14 15:50:00,2017-12-24 03:08:46
e44dd4b7-34d4-4f3d-966e-cbf2c08b91e8,vehicula consequat morbi a ipsum integer a nibh in quis justo maecenas rhoncus aliquam lacus morbi quis tortor id nulla,0f57bb0a-3cd6-47ec-ad95-111111111111,ACTIVE,2017-12-05 03:46:04,2017-12-15 10:11:38
c74e3225-ef5b-44b9-95c1-67217ca141a6,donec quis orci eget orci vehicula condimentum curabitur in libero ut massa volutpat,0f57bb0a-3cd6-47ec-ad95-111111111111,ACTIVE,2017-12-25 22:33:12,2017-12-03 04:55:17
e425730f-63bd-472a-99a3-f85eaa847cf7,lacus at velit vivamus vel nulla eget eros elementum pellentesque quisque,0f57bb0a-3cd6-47ec-ad95-111111111111,ACTIVE,2017-12-29 08:24:00,2017-12-10 04:36:43
4f44cbc7-af7f-4fb4-9dbf-2cdf9a904fec,pede libero quis orci nullam molestie nibh in lectus pellentesque at nulla suspendisse,0f57bb0a-3cd6-47ec-ad95-222222222222,ACTIVE,2017-12-06 15:25:19,2017-12-07 08:25:18
9d532a27-f7c8-49a4-b715-4587a016ccdb,pretium iaculis diam erat fermentum justo nec condimentum neque sapien placerat ante nulla justo aliquam quis turpis eget,0f57bb0a-3cd6-47ec-ad95-222222222222,ACTIVE,2017-12-15 22:03:40,2017-12-27 15:43:59
ca0b3353-b1c3-4424-bd8e-47cac703203e,ultrices posuere cubilia curae duis faucibus accumsan odio curabitur convallis duis consequat dui,0f57bb0a-3cd6-47ec-ad95-111111111111,ACTIVE,2017-12-13 18:52:05,2017-12-14 06:20:38
92474a20-6bb5-42ba-88cc-0805b4a65d20,tincidunt lacus at velit vivamus vel nulla eget eros elementum pellentesque quisque porta volutpat erat,0f57bb0a-3cd6-47ec-ad95-111111111111,ACTIVE,2017-12-11 01:32:28,2017-12-03 15:17:56
335d59fe-6be5-4559-8c65-566109fe0852,elit sodales scelerisque mauris sit amet eros suspendisse accumsan tortor quis turpis sed ante vivamus,0f57bb0a-3cd6-47ec-ad95-222222222222,ACTIVE,2017-12-23 22:31:28,2017-12-09 09:47:22
45d8432f-38aa-4973-b165-c49402a958c8,nulla sed vel enim sit amet nunc viverra dapibus nulla suscipit ligula in lacus curabitur at ipsum,0f57bb0a-3cd6-47ec-ad95-222222222222,ACTIVE,2017-12-14 08:36:19,2017-12-06 08:41:42
8a8cb203-8edd-49f1-a611-2d847a145c58,rutrum rutrum neque aenean auctor gravida sem praesent id massa id,0f57bb0a-3cd6-47ec-ad95-111111111111,ACTIVE,2017-12-05 17:45:22,2017-12-25 22:34:24
e2dce770-e72e-47d3-8f10-92acc6b8b566,amet justo morbi ut odio cras mi pede malesuada in imperdiet et commodo,0f57bb0a-3cd6-47ec-ad95-111111111111,ACTIVE,2017-12-09 20:11:55,2017-12-15 04:18:15
735c9637-4261-48b0-b046-6392de332587,leo odio condimentum id luctus nec molestie sed justo pellentesque viverra pede ac diam,0f57bb0a-3cd6-47ec-ad95-111111111111,ACTIVE,2017-12-13 01:56:52,2017-12-02 20:04:04
ccd7ee1c-75a8-4ffa-ab8b-2408fbe01850,nunc vestibulum ante ipsum primis in faucibus orci luctus et,0f57bb0a-3cd6-47ec-ad95-222222222222,ACTIVE,2017-12-20 09:12:50,2017-12-20 08:28:48
f0a89259-21b2-47a4-a337-a69e50ace50b,orci luctus et ultrices posuere cubilia curae nulla dapibus dolor vel est donec odio justo sollicitudin ut,0f57bb0a-3cd6-47ec-ad95-111111111111,ACTIVE,2017-12-13 00:55:06,2017-12-12 02:05:57
95f12009-ed75-4f11-9492-221d774b6544,fusce consequat nulla nisl nunc nisl duis bibendum felis sed interdum venenatis turpis enim,0f57bb0a-3cd6-47ec-ad95-111111111111,ACTIVE,2017-12-02 06:32:20,2017-12-21 06:05:29
4d67fcc3-9bd3-4f55-8b82-e6af1d16b8f9,ultrices posuere cubilia curae nulla dapibus dolor vel est donec odio justo sollicitudin,0f57bb0a-3cd6-47ec-ad95-222222222222,ACTIVE,2017-12-19 07:59:43,2017-12-07 05:01:49
be1af4f5-82bf-4c53-9f9e-f795fc5b1ad9,tincidunt nulla mollis molestie lorem quisque ut erat curabitur gravida nisi at nibh,0f57bb0a-3cd6-47ec-ad95-111111111111,ACTIVE,2017-12-16 08:47:04,2017-12-20 00:47:56
fb73316d-23e7-4993-af18-b047694159ac,vitae ipsum aliquam non mauris morbi non lectus aliquam sit amet diam in,0f57bb0a-3cd6-47ec-ad95-222222222222,ACTIVE,2017-12-13 05:59:07,2017-12-10 22:52:10
308c710b-2cca-440c-8afd-346d7cd5945a,magna bibendum imperdiet nullam orci pede venenatis non sodales sed tincidunt eu felis fusce posuere,0f57bb0a-3cd6-47ec-ad95-222222222222,ACTIVE,2017-12-04 12:47:44,2017-12-01 22:10:01
719b6eea-873f-4285-9eb4-b35e1a846951,pretium iaculis justo in hac habitasse platea dictumst etiam faucibus cursus urna ut tellus nulla ut erat id mauris,0f57bb0a-3cd6-47ec-ad95-222222222222,ACTIVE,2017-12-19 10:55:46,2017-12-29 09:29:16
dcac2745-4fe1-4870-be81-8b7436eba4e7,non velit donec diam neque vestibulum eget vulputate ut ultrices vel augue vestibulum ante ipsum primis in,0f57bb0a-3cd6-47ec-ad95-111111111111,ACTIVE,2017-12-28 21:26:59,2017-12-07 20:33:44
78f59dff-752e-4aec-88d0-8fe49bc0b280,magnis dis parturient montes nascetur ridiculus mus vivamus vestibulum sagittis sapien cum sociis natoque penatibus et magnis dis parturient,0f57bb0a-3cd6-47ec-ad95-222222222222,ACTIVE,2017-12-06 22:38:53,2017-12-24 00:47:34
3fc55d57-9607-4ba5-913e-09f636a7cf28,augue vestibulum rutrum rutrum neque aenean auctor gravida sem praesent id massa id nisl venenatis lacinia aenean sit,0f57bb0a-3cd6-47ec-ad95-111111111111,ACTIVE,2017-12-23 14:40:21,2017-12-02 13:26:35
764d2c0b-d53b-40ad-85e8-9f56fa3c6d3e,non mauris morbi non lectus aliquam sit amet diam in magna bibendum,0f57bb0a-3cd6-47ec-ad95-111111111111,ACTIVE,2017-12-23 23:12:22,2017-12-10 16:09:31
042f7f97-f4f6-43f3-b3f5-4b4574092a2e,at nunc commodo placerat praesent blandit nam nulla integer pede justo lacinia eget tincidunt eget tempus,0f57bb0a-3cd6-47ec-ad95-222222222222,ACTIVE,2017-12-01 10:38:25,2017-12-20 22:51:08
6a1c9eaf-afc4-4b6d-8a4d-1d79613b0b65,praesent id massa id nisl venenatis lacinia aenean sit amet justo,0f57bb0a-3cd6-47ec-ad95-222222222222,ACTIVE,2017-12-16 11:39:22,2017-12-15 10:19:36
19c67e6f-81e5-4484-8822-e3c33cb2845c,diam in magna bibendum imperdiet nullam orci pede venenatis non sodales sed,0f57bb0a-3cd6-47ec-ad95-111111111111,ACTIVE,2017-12-14 01:02:00,2017-12-08 03:21:00
b3b80c75-2935-4f18-bc39-13bfb1292ac8,eget rutrum at lorem integer tincidunt ante vel ipsum praesent blandit lacinia erat vestibulum sed magna,0f57bb0a-3cd6-47ec-ad95-111111111111,ACTIVE,2017-12-22 22:53:59,2017-12-18 11:40:47
5d4a0b6d-7085-4a48-94d2-10bbed6f141e,blandit nam nulla integer pede justo lacinia eget tincidunt eget tempus vel pede morbi porttitor lorem id,0f57bb0a-3cd6-47ec-ad95-222222222222,ACTIVE,2017-12-27 19:32:35,2017-12-03 16:46:05
388e179e-16cc-4159-900e-0bcfea8baad6,semper rutrum nulla nunc purus phasellus in felis donec semper sapien a libero nam,0f57bb0a-3cd6-47ec-ad95-111111111111,ACTIVE,2017-12-18 11:40:49,2017-12-29 09:02:35
8169958f-c6a1-4050-b287-2d9a7ec3526c,sodales sed tincidunt eu felis fusce posuere felis sed lacus morbi,0f57bb0a-3cd6-47ec-ad95-222222222222,ACTIVE,2017-12-15 20:02:21,2017-12-22 08:36:34
b8291e64-4877-411b-bee5-66756cb2bd5d,consectetuer adipiscing elit proin interdum mauris non ligula pellentesque ultrices,0f57bb0a-3cd6-47ec-ad95-222222222222,ACTIVE,2017-12-15 19:29:07,2017-12-03 14:06:22
744cbe98-afa6-4c59-9ecc-282427e6b440,id lobortis convallis tortor risus dapibus augue vel accumsan tellus nisi eu orci mauris,0f57bb0a-3cd6-47ec-ad95-222222222222,ACTIVE,2017-12-14 22:35:15,2017-12-01 11:15:48
f77fdf88-3259-4b14-9e4a-bab73906b964,donec vitae nisi nam ultrices libero non mattis pulvinar nulla,0f57bb0a-3cd6-47ec-ad95-111111111111,ACTIVE,2017-12-07 02:22:18,2017-12-08 04:59:45
582e31cc-3a3e-490a-887a-b0a4c5951ed3,ipsum aliquam non mauris morbi non lectus aliquam sit amet diam in magna bibendum imperdiet nullam orci pede,0f57bb0a-3cd6-47ec-ad95-222222222222,ACTIVE,2017-12-18 00:24:43,2017-12-23 09:06:11
