transaction_id,detail,merchant_id,status,created_at,updated_at
d17466e1-b8c2-430b-a8ee-400f26411035,lacus morbi quis tortor id nulla ultrices aliquet maecenas leo odio condimentum id luctus nec molestie sed justo,0f57bb0a-3cd6-47ec-ad95-111111111111,ACTIVE,2017-12-28 08:55:56,2017-12-03 10:18:18
30b7e962-f7eb-4b7b-83b0-82a531ba5088,mattis odio donec vitae nisi nam ultrices libero non mattis pulvinar,0f57bb0a-3cd6-47ec-ad95-222222222222,ACTIVE,2017-12-24 18:33:17,2017-12-02 17:28:43
77dfb16e-44d9-4983-b08a-badf89e01080,in lectus pellentesque at nulla suspendisse potenti cras in purus,0f57bb0a-3cd6-47ec-ad95-111111111111,ACTIVE,2017-12-04 06:03:47,2017-12-22 06:57:24
450dcd61-723e-4595-968d-5d1026f1abbc,praesent blandit nam nulla integer pede justo lacinia eget tincidunt eget tempus vel pede morbi porttitor lorem,0f57bb0a-3cd6-47ec-ad95-222222222222,ACTIVE,2017-12-05 01:24:47,2017-12-20 05:39:33
b7faff6e-bd59-4611-8c59-20c8c29d0082,turpis adipiscing lorem vitae mattis nibh ligula nec sem duis aliquam,0f57bb0a-3cd6-47ec-ad95-222222222222,ACTIVE,2017-12-10 22:27:02,2017-12-07 18:43:53
81cd1cff-51bb-4d35-a3d7-d142a00dc9d0,libero ut massa volutpat convallis morbi odio odio elementum eu interdum,0f57bb0a-3cd6-47ec-ad95-111111111111,ACTIVE,2017-12-13 17:56:37,2017-12-18 02:38:48
d7b1f38b-fb15-4691-a814-9b08e47d174e,libero non mattis pulvinar nulla pede ullamcorper augue a suscipit nulla elit,0f57bb0a-3cd6-47ec-ad95-111111111111,ACTIVE,2017-12-24 01:19:17,2017-12-01 18:41:07
b58ea15a-0d3b-4979-a77c-7ccb63add2f6,vel augue vestibulum rutrum rutrum neque aenean auctor gravida sem praesent id massa id nisl venenatis lacinia aenean,0f57bb0a-3cd6-47ec-ad95-111111111111,ACTIVE,2017-12-01 07:06:46,2017-12-15 16:55:53
705fd49f-8023-48a5-9b63-08d3cbdb5413,id turpis integer aliquet massa id lobortis convallis tortor risus dapibus augue vel accumsan tellus nisi eu orci mauris lacinia,0f57bb0a-3cd6-47ec-ad95-222222222222,ACTIVE,2017-12-26 18:07:48,2017-12-11 17:39:00
061ee22d-1c82-4e78-9ad6-4d54513c3d94,nonummy maecenas tincidunt lacus at velit vivamus vel nulla eget eros elementum,0f57bb0a-3cd6-47ec-ad95-222222222222,ACTIVE,2017-12-09 02:54:45,2017-12-02 07:17:36
8402c56c-27b0-4836-bfc8-ea540ec37429,fringilla rhoncus mauris enim leo rhoncus sed vestibulum sit amet cursus id turpis integer aliquet massa id lobortis convallis,0f57bb0a-3cd6-47ec-ad95-222222222222,ACTIVE,2017-12-19 10:53:19,2017-12-08 10:22:29
d76cac1e-f664-462e-8523-7287b51415a2,vestibulum ante ipsum primis in faucibus orci luctus et ultrices posuere cubilia curae donec pharetra magna vestibulum aliquet,0f57bb0a-3cd6-47ec-ad95-222222222222,ACTIVE,2017-12-13 03:37:06,2017-12-17 15:11:38
75e1e25f-22a2-404c-b528-4cb747b5e106,amet diam in magna bibendum imperdiet nullam orci pede venenatis non sodales sed tincidunt eu felis,0f57bb0a-3cd6-47ec-ad95-111111111111,ACTIVE,2017-12-26 21:20:16,2017-12-12 21:30:41
a77931df-46ff-4913-a5bd-403011fa8d69,eu felis fusce posuere felis sed lacus morbi sem mauris laoreet ut rhoncus aliquet pulvinar sed nisl,0f57bb0a-3cd6-47ec-ad95-222222222222,ACTIVE,2017-12-23 14:43:29,2017-12-27 00:11:51
b172b5bc-2e40-4cd1-8cfa-bd590270df2d,eleifend donec ut dolor morbi vel lectus in quam fringilla rhoncus mauris enim leo rhoncus sed vestibulum,0f57bb0a-3cd6-47ec-ad95-222222222222,ACTIVE,2017-12-11 18:06:37,2017-12-25 01:24:28
c68aa411-9764-46e2-86b2-6085806e2c35,eleifend pede libero quis orci nullam molestie nibh in lectus pellentesque at nulla suspendisse potenti cras in,0f57bb0a-3cd6-47ec-ad95-222222222222,ACTIVE,2017-12-24 11:32:39,2017-12-04 10:18:46
6b482e77-ac94-485a-8958-096ba0e4da13,turpis enim blandit mi in porttitor pede justo eu massa donec dapibus duis at velit eu est congue elementum in,0f57bb0a-3cd6-47ec-ad95-222222222222,ACTIVE,2017-12-02 07:18:55,2017-12-21 12:10:22
732c3068-6851-45ef-a4e1-5c34006c118e,at turpis donec posuere metus vitae ipsum aliquam non mauris morbi non lectus aliquam sit amet diam in magna bibendum,0f57bb0a-3cd6-47ec-ad95-222222222222,ACTIVE,2017-12-03 02:28:03,2017-12-15 00:48:25
0e1b6ff6-63a1-4444-ab97-c011f31fdbcd,at turpis donec posuere metus vitae ipsum aliquam non mauris morbi non lectus aliquam,0f57bb0a-3cd6-47ec-ad95-222222222222,ACTIVE,2017-12-11 01:25:19,2017-12-30 08:20:27
c26b8c6b-bfa9-4f9c-a948-7ae40609df87,imperdiet et commodo vulputate justo in blandit ultrices enim lorem ipsum dolor sit amet consectetuer adipiscing elit proin interdum,0f57bb0a-3cd6-47ec-ad95-222222222222,ACTIVE,2017-12-26 12:58:22,2017-12-04 14:10:37
c924e598-487b-495f-abd5-ce7eb526df10,felis sed interdum venenatis turpis enim blandit mi in porttitor pede justo eu massa donec dapibus duis,0f57bb0a-3cd6-47ec-ad95-222222222222,ACTIVE,2017-12-19 12:30:21,2017-12-30 02:17:26
d10d3682-03c2-483a-8171-1718427d2f13,justo eu massa donec dapibus duis at velit eu est congue elementum in hac habitasse,0f57bb0a-3cd6-47ec-ad95-222222222222,ACTIVE,2017-12-27 14:48:30,2017-12-29 17:44:03
10bb0e06-2c82-415f-8c3b-95ef547177c2,etiam vel augue vestibulum rutrum rutrum neque aenean auctor gravida sem,0f57bb0a-3cd6-47ec-ad95-111111111111,ACTIVE,2017-12-12 11:39:26,2017-12-26 21:20:13
adeca742-6a3c-4f3d-9457-e1655ce9003a,parturient montes nascetur ridiculus mus vivamus vestibulum sagittis sapien cum sociis natoque,0f57bb0a-3cd6-47ec-ad95-222222222222,ACTIVE,2017-12-20 05:37:00,2017-12-18 23:14:06
4825d56c-10ac-4c09-8732-4bdda340ecb9,sagittis nam congue risus semper porta volutpat quam pede lobortis ligula sit amet eleifend pede libero,0f57bb0a-3cd6-47ec-ad95-222222222222,ACTIVE,2017-12-05 04:17:32,2017-12-28 20:37:03
03fa02e2-9549-47f0-a07a-7a2009f08ecc,duis aliquam convallis nunc proin at turpis a pede posuere nonummy integer non velit donec diam neque vestibulum eget vulputate,0f57bb0a-3cd6-47ec-ad95-222222222222,ACTIVE,2017-12-06 13:56:13,2017-12-13 07:24:23
ee6633a0-db90-4f15-9b13-8c6808a64360,sit amet turpis elementum ligula vehicula consequat morbi a ipsum integer a,0f57bb0a-3cd6-47ec-ad95-111111111111,ACTIVE,2017-12-09 06:17:31,2017-12-23 08:39:24
f0b8273e-6970-4c13-aee2-63d5c06f0392,cum sociis natoque penatibus et magnis dis parturient montes nascetur ridiculus mus etiam vel augue vestibulum rutrum,0f57bb0a-3cd6-47ec-ad95-222222222222,ACTIVE,2017-12-18 00:10:20,2017-12-02 15:22:44
b898071b-a030-4994-83ed-09ef2ffbfde1,pellentesque viverra pede ac diam cras pellentesque volutpat dui maecenas tristique est et tempus semper est quam pharetra magna,0f57bb0a-3cd6-47ec-ad95-111111111111,ACTIVE,2017-12-07 06:47:33,2017-12-14 09:28:35
d71a057d-a26b-4147-925b-6bfff0f2421a,nec condimentum neque sapien placerat ante nulla justo aliquam quis turpis eget elit sodales scelerisque mauris sit,0f57bb0a-3cd6-47ec-ad95-222222222222,ACTIVE,2017-12-21 22:27:19,2017-12-26 03:28:41
c20b7d3a-e8e9-4392-8d6b-74176532f2e8,ut suscipit a feugiat et eros vestibulum ac est lacinia nisi,0f57bb0a-3cd6-47ec-ad95-111111111111,ACTIVE,2017-12-18 22:20:46,2017-12-16 12:34:09
8f85cd75-1311-4322-b4da-0cf36e20a555,dolor morbi vel lectus in quam fringilla rhoncus mauris enim leo,0f57bb0a-3cd6-47ec-ad95-222222222222,ACTIVE,2017-12-08 17:06:55,2017-12-21 21:23:38
c83239e8-843f-4407-b8a6-5e8acb244f4a,turpis nec euismod scelerisque quam turpis adipiscing lorem vitae mattis nibh ligula nec,0f57bb0a-3cd6-47ec-ad95-222222222222,ACTIVE,2017-12-15 18:26:10,2017-12-09 10:56:29
6713d999-eef6-419f-b4fc-93e1a7cc59f2,vehicula consequat morbi a ipsum integer a nibh in quis justo maecenas rhoncus aliquam lacus morbi quis tortor id nulla,0f57bb0a-3cd6-47ec-ad95-222222222222,ACTIVE,2017-12-10 22:54:18,2017-12-08 23:00:36
81f31aab-def2-4d1e-b955-0d527e915336,in lectus pellentesque at nulla suspendisse potenti cras in purus,0f57bb0a-3cd6-47ec-ad95-111111111111,ACTIVE,2017-12-01 13:42:14,2017-12-03 03:09:11
d0017bd8-fe08-4e56-a8ce-6bd191b70a7c,nisi volutpat eleifend donec ut dolor morbi vel lectus in quam fringilla rhoncus mauris,0f57bb0a-3cd6-47ec-ad95-222222222222,ACTIVE,2017-12-06 13:17:13,2017-12-21 14:34:02
f7a7de23-a6e4-4882-9906-c062b7e30aba,amet diam in magna bibendum imperdiet nullam orci pede venenatis non sodales sed,0f57bb0a-3cd6-47ec-ad95-222222222222,ACTIVE,2017-12-25 07:55:18,2017-12-11 07:41:51
ced0cd16-04ac-425e-9374-7493e636a601,molestie nibh in lectus pellentesque at nulla suspendisse potenti cras,0f57bb0a-3cd6-47ec-ad95-111111111111,ACTIVE,2017-12-18 18:07:22,2017-12-07 10:28:32
92927aa9-9279-49a5-b82d-db9e32594638,iaculis justo in hac habitasse platea dictumst etiam faucibus cursus urna ut tellus nulla ut,0f57bb0a-3cd6-47ec-ad95-222222222222,ACTIVE,2017-12-16 04:02:00,2017-12-07 18:50:10
76a97b38-1750-4285-becd-1a2f620fd05d,accumsan felis ut at dolor quis odio consequat varius integer ac leo pellentesque ultrices mattis odio donec vitae nisi,0f57bb0a-3cd6-47ec-ad95-111111111111,ACTIVE,2017-12-25 04:22:13,2017-12-28 23:06:31
f804f5c4-5523-43a1-8202-5b091786f0e6,dui proin leo odio porttitor id consequat in consequat ut nulla sed accumsan felis,0f57bb0a-3cd6-47ec-ad95-222222222222,ACTIVE,2017-12-04 23:58:59,2017-12-03 02:54:44
b1145830-26b8-466d-be15-ba6df59b907f,suspendisse potenti cras in purus eu magna vulputate luctus cum sociis natoque penatibus et magnis dis,0f57bb0a-3cd6-47ec-ad95-222222222222,ACTIVE,2017-12-07 02:52:54,2017-12-11 10:43:21
9901b1cc-ad6f-4375-9410-4a32bb24386d,amet sapien dignissim vestibulum vestibulum ante ipsum primis in faucibus orci luctus et ultrices posuere cubilia curae,0f57bb0a-3cd6-47ec-ad95-222222222222,ACTIVE,2017-12-21 03:29:48,2017-12-02 14:33:13
80c887d8-44e4-4538-8471-24ca14f426f2,ipsum primis in faucibus orci luctus et ultrices posuere cubilia curae mauris viverra diam vitae quam suspendisse,0f57bb0a-3cd6-47ec-ad95-111111111111,ACTIVE,2017-12-01 11:31:23,2017-12-29 22:02:20
8dae5d8e-98c0-4278-a16b-9c4ee33efe61,lorem ipsum dolor sit amet consectetuer adipiscing elit proin risus praesent lectus vestibulum quam,0f57bb0a-3cd6-47ec-ad95-111111111111,ACTIVE,2017-12-04 14:12:00,2017-12-21 16:35:02
04b5be9f-fd0a-48c4-bf89-e7ec33374aea,sodales scelerisque mauris sit amet eros suspendisse accumsan tortor quis turpis sed ante vivamus tortor,0f57bb0a-3cd6-47ec-ad95-222222222222,ACTIVE,2017-12-24 17:34:56,2017-12-11 13:53:05
391170e2-3253-4d8d-8206-e90cdb5d58f6,quisque porta volutpat erat quisque erat eros viverra eget congue,0f57bb0a-3cd6-47ec-ad95-222222222222,ACTIVE,2017-12-24 18:22:01,2017-12-29 03:52:19
c4821720-63bc-46f3-91a7-50e3ac26a469,sapien a libero nam dui proin leo odio porttitor id consequat in consequat ut,0f57bb0a-3cd6-47ec-ad95-111111111111,ACTIVE,2017-12-26 19:06:46,2017-12-03 21:57:37
81f00d20-f59b-442c-b5a6-382561ebe791,purus phasellus in felis donec semper sapien a libero nam dui proin leo odio porttitor id consequat in consequat ut,0f57bb0a-3cd6-47ec-ad95-111111111111,ACTIVE,2017-12-27 03:51:39,2017-12-02 08:03:20
cefea156-e606-48a7-b610-5a7deb3dd38c,phasellus id sapien in sapien iaculis congue vivamus metus arcu adipiscing,0f57bb0a-3cd6-47ec-ad95-111111111111,ACTIVE,2017-12-12 07:02:37,2017-12-08 18:05:45
9e79bd8b-353c-4f76-95cf-eab6e2835fa5,et ultrices posuere cubilia curae nulla dapibus dolor vel est donec odio justo sollicitudin ut suscipit a feugiat et,0f57bb0a-3cd6-47ec-ad95-222222222222,ACTIVE,2017-12-28 01:01:06,2017-12-08 15:22:43
64475c14-094a-48c2-911e-9db61a539ab5,imperdiet nullam orci pede venenatis non sodales sed tincidunt eu felis fusce posuere,0f57bb0a-3cd6-47ec-ad95-111111111111,ACTIVE,2017-12-25 10:50:40,2017-12-09 23:20:16
76189f7a-3ee4-4aaf-8864-c1289dcdf1f3,vivamus vestibulum sagittis sapien cum sociis natoque penatibus et magnis dis parturient montes nascetur ridiculus mus etiam vel augue,0f57bb0a-3cd6-47ec-ad95-222222222222,ACTIVE,2017-12-22 11:19:23,2017-12-08 23:27:28
9a4f4adf-f5e5-49db-8d9b-b633054a2692,vel lectus in quam fringilla rhoncus mauris enim leo rhoncus sed vestibulum,0f57bb0a-3cd6-47ec-ad95-111111111111,ACTIVE,2017-12-24 19:56:11,2017-12-25 00:52:49
b3d30acd-1b53-4c1f-a6b5-668c5345f885,nisl aenean lectus pellentesque eget nunc donec quis orci eget orci vehicula condimentum curabitur in,0f57bb0a-3cd6-47ec-ad95-222222222222,ACTIVE,2017-12-20 04:45:17,2017-12-28 04:40:09
740331f9-6bec-4710-8d40-0caf52589596,nulla nunc purus phasellus in felis donec semper sapien a libero nam dui proin leo odio porttitor id consequat,0f57bb0a-3cd6-47ec-ad95-111111111111,ACTIVE,2017-12-26 16:46:33,2017-12-30 06:20:14
b43794f0-13e1-4efa-a1c7-b0ad331d6e00,rutrum nulla tellus in sagittis dui vel nisl duis ac nibh fusce lacus purus aliquet,0f57bb0a-3cd6-47ec-ad95-111111111111,ACTIVE,2017-12-22 04:27:05,2017-12-08 18:17:31
bc22109f-64f6-4a35-964c-1c4618a7fe00,volutpat quam pede lobortis ligula sit amet eleifend pede libero quis orci nullam,0f57bb0a-3cd6-47ec-ad95-222222222222,ACTIVE,2017-12-06 21:49:51,2017-12-26 05:02:12
5e9047de-5575-4703-a56d-f26b27be7127,in porttitor pede justo eu massa donec dapibus duis at velit eu est congue elementum in hac habitasse platea,0f57bb0a-3cd6-47ec-ad95-111111111111,ACTIVE,2017-12-12 07:52:12,2017-12-17 14:12:49
20fd3ca6-176f-4a43-8d56-5e9429e13f82,id lobortis convallis tortor risus dapibus augue vel accumsan tellus nisi eu orci mauris,0f57bb0a-3cd6-47ec-ad95-111111111111,ACTIVE,2017-12-14 10:00:22,2017-12-20 01:18:38
787e74fd-9cb5-4339-859c-53c4338755b3,consequat dui nec nisi volutpat eleifend donec ut dolor morbi vel lectus in quam fringilla rhoncus,0f57bb0a-3cd6-47ec-ad95-222222222222,ACTIVE,2017-12-11 11:10:43,2017-12-27 20:51:09
8926af4b-6086-459f-b65a-3139a69fbd7f,turpis adipiscing lorem vitae mattis nibh ligula nec sem duis,0f57bb0a-3cd6-47ec-ad95-222222222222,ACTIVE,2017-12-28 20:50:48,2017-12-20 06:10:12
a75e564f-2427-41d4-a06d-f98ff654abea,vel est donec odio justo sollicitudin ut suscipit a feugiat et eros vestibulum ac est,0f57bb0a-3cd6-47ec-ad95-111111111111,ACTIVE,2017-12-08 23:15:09,2017-12-10 05:03:45
a28422c5-05ce-4107-9694-70bd301bb7c4,fusce posuere felis sed lacus morbi sem mauris laoreet ut rhoncus,0f57bb0a-3cd6-47ec-ad95-222222222222,ACTIVE,2017-12-20 21:08:39,2017-12-12 12:08:22
646eebe0-1bbd-478e-830b-3105d6fff91a,et commodo vulputate justo in blandit ultrices enim lorem ipsum dolor,0f57bb0a-3cd6-47ec-ad95-222222222222,ACTIVE,2017-12-27 20:29:52,2017-12-21 14:20:55
310a9971-abf4-46a4-8f77-e69be9d369d4,faucibus orci luctus et ultrices posuere cubilia curae mauris viverra diam vitae quam suspendisse potenti nullam,0f57bb0a-3cd6-47ec-ad95-111111111111,ACTIVE,2017-12-17 16:09:19,2017-12-24 04:44:10
3a2bed8f-f1f8-41fa-ad28-d6a7ae743c70,accumsan felis ut at dolor quis odio consequat varius integer ac leo pellentesque ultrices mattis,0f57bb0a-3cd6-47ec-ad95-222222222222,ACTIVE,2017-12-06 11:02:07,2017-12-17 10:16:10
27c367e1-97c9-4531-8ac3-01d04536214e,ipsum ac tellus semper interdum mauris ullamcorper purus sit amet nulla quisque arcu libero rutrum ac lobortis vel,0f57bb0a-3cd6-47ec-ad95-111111111111,ACTIVE,2017-12-27 20:56:25,2017-12-28 11:44:06
50fc19e4-8493-4400-a2ec-bfbe31cc6b37,at lorem integer tincidunt ante vel ipsum praesent blandit lacinia erat vestibulum sed magna at,0f57bb0a-3cd6-47ec-ad95-222222222222,ACTIVE,2017-12-07 02:48:17,2017-12-18 08:45:11
63ba7e81-2237-46ab-afc3-960a41c6ea30,erat vestibulum sed magna at nunc commodo placerat praesent blandit nam nulla integer pede justo lacinia,0f57bb0a-3cd6-47ec-ad95-111111111111,ACTIVE,2017-12-10 02:28:35,2017-12-28 23:49:49
3d790213-c37e-40d0-872b-552e12745f77,ac leo pellentesque ultrices mattis odio donec vitae nisi nam ultrices libero non mattis pulvinar nulla pede ullamcorper,0f57bb0a-3cd6-47ec-ad95-222222222222,ACTIVE,2017-12-16 01:22:21,2017-12-29 12:52:46
0c46ce35-a26f-4061-b685-97a55e553013,molestie lorem quisque ut erat curabitur gravida nisi at nibh in hac habitasse platea,0f57bb0a-3cd6-47ec-ad95-222222222222,ACTIVE,2017-12-12 03:58:57,2017-12-14 00:28:27
a0da8487-12aa-4c75-87d8-1b85da27172d,ante ipsum primis in faucibus orci luctus et ultrices posuere cubilia curae duis,0f57bb0a-3cd6-47ec-ad95-111111111111,ACTIVE,2017-12-21 11:37:18,2017-12-12 08:29:53
c05f18eb-5136-4950-9c10-870a75c44b0a,erat eros viverra eget congue eget semper rutrum nulla nunc purus phasellus in felis donec semper sapien a,0f57bb0a-3cd6-47ec-ad95-222222222222,ACTIVE,2017-12-06 18:40:41,2017-12-22 16:37:51
209bc6c9-2804-43e0-9462-ec9e38dcede1,augue vel accumsan tellus nisi eu orci mauris lacinia sapien quis libero nullam sit,0f57bb0a-3cd6-47ec-ad95-222222222222,ACTIVE,2017-12-03 22:43:30,2017-12-07 09:01:34
38675e50-e83f-46f8-9f81-e88cbfdbc67e,pellentesque viverra pede ac diam cras pellentesque volutpat dui maecenas tristique est et tempus,0f57bb0a-3cd6-47ec-ad95-111111111111,ACTIVE,2017-12-23 03:27:19,2017-12-12 20:18:14
370811c4-94a3-41ac-bb7c-3f01ae53f423,venenatis turpis enim blandit mi in porttitor pede justo eu,0f57bb0a-3cd6-47ec-ad95-111111111111,ACTIVE,2017-12-30 09:03:06,2017-12-21 03:12:51
b97ed030-f25a-4255-97c3-95bb3ee8d643,et eros vestibulum ac est lacinia nisi venenatis tristique fusce congue diam id ornare imperdiet sapien urna pretium nisl ut,0f57bb0a-3cd6-47ec-ad95-111111111111,ACTIVE,2017-12-17 15:42:07,2017-12-14 15:26:18
2a8ac6d6-fc33-4e7a-8706-e33c3abd4278,posuere metus vitae ipsum aliquam non mauris morbi non lectus aliquam sit amet,0f57bb0a-3cd6-47ec-ad95-111111111111,ACTIVE,2017-12-19 19:18:57,2017-12-30 01:25:04
97ef9699-710f-47ec-af65-92afe406f73a,id massa id nisl venenatis lacinia aenean sit amet justo morbi ut odio cras mi pede malesuada in,0f57bb0a-3cd6-47ec-ad95-111111111111,ACTIVE,2017-12-19 16:25:12,2017-12-22 07:45:37
73542a6e-b797-4f19-9f24-3a43d2cce585,in magna bibendum imperdiet nullam orci pede venenatis non sodales sed,0f57bb0a-3cd6-47ec-ad95-222222222222,ACTIVE,2017-12-26 22:56:22,2017-12-24 07:19:23
fee4877b-fe47-4102-a96f-4fa3c27c39ed,elementum in hac habitasse platea dictumst morbi vestibulum velit id pretium iaculis diam erat fermentum justo nec condimentum,0f57bb0a-3cd6-47ec-ad95-222222222222,ACTIVE,2017-12-22 18:55:47,2017-12-02 13:02:10
ca96625d-0489-4c47-97e6-4f0dfbca7c0b,sapien quis libero nullam sit amet turpis elementum ligula vehicula consequat morbi a ipsum integer a nibh in quis,0f57bb0a-3cd6-47ec-ad95-111111111111,ACTIVE,2017-12-08 11:05:07,2017-12-12 01:59:10
bc5e2cd6-c72d-41ce-91ba-91c367f89cd8,pharetra magna vestibulum aliquet ultrices erat tortor sollicitudin mi sit amet lobortis sapien sapien non mi,0f57bb0a-3cd6-47ec-ad95-222222222222,ACTIVE,2017-12-12 23:32:50,2017-12-12 14:44:42
b84580b8-8842-4102-bd42-4c84de29e54a,ut mauris eget massa tempor convallis nulla neque libero convallis eget eleifend luctus ultricies eu nibh,0f57bb0a-3cd6-47ec-ad95-111111111111,ACTIVE,2017-12-29 03:58:00,2017-12-04 00:20:00
a14c9194-7ad7-42eb-8482-32431ce7d461,aliquet massa id lobortis convallis tortor risus dapibus augue vel,0f57bb0a-3cd6-47ec-ad95-222222222222,ACTIVE,2017-12-15 10:46:46,2017-12-01 03:18:20
a98676b2-81c8-4333-a1ea-09e3dca8501c,lacinia sapien quis libero nullam sit amet turpis elementum ligula vehicula,0f57bb0a-3cd6-47ec-ad95-222222222222,ACTIVE,2017-12-20 05:36:13,2017-12-21 12:22:20
4ac100cc-a497-4171-9eee-42d2f3e6981d,tincidunt lacus at velit vivamus vel nulla eget eros elementum pellentesque quisque porta volutpat erat quisque,0f57bb0a-3cd6-47ec-ad95-222222222222,ACTIVE,2017-12-23 18:10:30,2017-12-02 14:17:22
b4681a73-5499-4bc3-b03e-76cb9f79f672,lectus pellentesque at nulla suspendisse potenti cras in purus eu magna vulputate luctus,0f57bb0a-3cd6-47ec-ad95-222222222222,ACTIVE,2017-12-29 17:32:38,2017-12-07 13:29:50
3597583f-69d7-4e9a-86d7-5e03d1132b27,pretium iaculis justo in hac habitasse platea dictumst etiam faucibus cursus urna ut tellus nulla ut erat id mauris,0f57bb0a-3cd6-47ec-ad95-222222222222,ACTIVE,2017-12-22 03:06:54,2017-12-03 15:31:57
33f064dc-880f-4594-9788-82e9b3e6ae0f,interdum in ante vestibulum ante ipsum primis in faucibus orci luctus et ultrices posuere cubilia,0f57bb0a-3cd6-47ec-ad95-111111111111,ACTIVE,2017-12-11 04:53:12,2017-12-01 20:03:26
52df410a-b022-4499-8854-e67d513b1afa,turpis donec posuere metus vitae ipsum aliquam non mauris morbi non lectus aliquam sit amet diam,0f57bb0a-3cd6-47ec-ad95-222222222222,ACTIVE,2017-12-29 19:39:52,2017-12-13 17:38:19
601e4cc1-2dc1-4660-a042-fa0f7d217169,id luctus nec molestie sed justo pellentesque viverra pede ac diam,0f57bb0a-3cd6-47ec-ad95-222222222222,ACTIVE,2017-12-23 08:49:38,2017-12-28 10:47:08
12b1d533-0a65-4333-a51f-0a1b69feb158,tristique in tempus sit amet sem fusce consequat nulla nisl,0f57bb0a-3cd6-47ec-ad95-111111111111,ACTIVE,2017-12-28 13:15:02,2017-12-06 11:53:59
270d56a4-e033-4369-ad61-2afe8d8d3822,sagittis nam congue risus semper porta volutpat quam pede lobortis ligula sit amet eleifend pede libero,0f57bb0a-3cd6-47ec-ad95-111111111111,ACTIVE,2017-12-02 18:30:24,2017-12-01 09:17:43
9baf580d-a296-4b73-ac10-ab82522a3daf,justo etiam pretium iaculis justo in hac habitasse platea dictumst etiam faucibus cursus,0f57bb0a-3cd6-47ec-ad95-222222222222,ACTIVE,2017-12-08 08:25:25,2017-12-01 05:54:18
00f30a57-0fd4-4628-80a3-241b4a9cac79,massa id nisl venenatis lacinia aenean sit amet justo morbi ut odio,0f57bb0a-3cd6-47ec-ad95-111111111111,ACTIVE,2017-12-24 14:21:44,2017-12-20 15:57:46
4ed82f92-6814-4e81-b09b-4654e4885edb,id pretium iaculis diam erat fermentum justo nec condimentum neque,0f57bb0a-3cd6-47ec-ad95-111111111111,ACTIVE,2017-12-18 02:44:19,2017-12-07 17:30:01
a4eff352-0b9d-42f4-9677-6592a39aabfd,ipsum dolor sit amet consectetuer adipiscing elit proin interdum mauris non,0f57bb0a-3cd6-47ec-ad95-222222222222,ACTIVE,2017-12-16 09:05:57,2017-12-23 05:35:23
eff3aa53-291b-4b91-abfa-0e8762bf7c50,elementum pellentesque quisque porta volutpat erat quisque erat eros viverra eget congue eget semper rutrum nulla nunc purus phasellus,0f57bb0a-3cd6-47ec-ad95-222222222222,ACTIVE,2017-12-21 01:43:03,2017-12-19 03:09:42
93ab3a31-e4a2-4de7-ac46-564cc6426e1e,euismod scelerisque quam turpis adipiscing lorem vitae mattis nibh ligula nec,0f57bb0a-3cd6-47ec-ad95-222222222222,ACTIVE,2017-12-22 14:09:32,2017-12-30 11:32:05
77aab0a2-d0bf-4d13-8fb1-3fddcf382132,magnis dis parturient montes nascetur ridiculus mus etiam vel augue,0f57bb0a-3cd6-47ec-ad95-111111111111,ACTIVE,2017-12-01 23:25:26,2017-12-02 12:33:24
d7f30ecb-0516-4bc5-8182-98fc53e89616,fringilla rhoncus mauris enim leo rhoncus sed vestibulum sit amet cursus id turpis integer aliquet,0f57bb0a-3cd6-47ec-ad95-111111111111,ACTIVE,2017-12-29 08:57:05,2017-12-23 01:54:30
5ac66de6-99eb-45a7-bfb9-18aa15ad2321,semper sapien a libero nam dui proin leo odio porttitor id consequat in consequat ut nulla sed accumsan,0f57bb0a-3cd6-47ec-ad95-111111111111,ACTIVE,2017-12-06 20:40:52,2017-12-21 01:45:32
ad5242d5-a4f3-4842-96e3-0500d77f4835,consequat morbi a ipsum integer a nibh in quis justo,0f57bb0a-3cd6-47ec-ad95-111111111111,ACTIVE,2017-12-12 18:15:34,2017-12-01 13:37:42
4b0e19a0-9ef2-406e-a8c2-3ce898486f96,ut nunc vestibulum ante ipsum primis in faucibus orci luctus et ultrices posuere cubilia curae mauris viverra diam,0f57bb0a-3cd6-47ec-ad95-222222222222,ACTIVE,2017-12-30 04:33:22,2017-12-23 20:40:50
5b34b27a-b837-4aa2-b0e3-28a387b671a8,aliquam non mauris morbi non lectus aliquam sit amet diam in magna bibendum imperdiet nullam orci pede venenatis,0f57bb0a-3cd6-47ec-ad95-222222222222,ACTIVE,2017-12-20 23:50:31,2017-12-09 23:12:52
d8189799-5dbe-47d1-ad0e-7390f1e57111,magna bibendum imperdiet nullam orci pede venenatis non sodales sed tincidunt eu felis,0f57bb0a-3cd6-47ec-ad95-111111111111,ACTIVE,2017-12-20 03:55:37,2017-12-15 08:20:25
537d91a8-76dd-433c-8e23-d92293a2bed7,habitasse platea dictumst morbi vestibulum velit id pretium iaculis diam erat fermentum justo nec condimentum neque,0f57bb0a-3cd6-47ec-ad95-222222222222,ACTIVE,2017-12-26 16:25:14,2017-12-14 19:20:45
69a74e50-6d63-4110-9470-38e108a955be,pellentesque volutpat dui maecenas tristique est et tempus semper est quam pharetra magna ac consequat metus,0f57bb0a-3cd6-47ec-ad95-111111111111,ACTIVE,2017-12-29 21:43:55,2017-12-08 01:14:45
18206ef0-d10e-4370-bd09-cab7720b66db,metus sapien ut nunc vestibulum ante ipsum primis in faucibus orci luctus et ultrices,0f57bb0a-3cd6-47ec-ad95-111111111111,ACTIVE,2017-12-29 14:51:45,2017-12-21 23:13:16
a2ac83af-b5f1-4dee-91e9-0f05949c1d71,nibh in hac habitasse platea dictumst aliquam augue quam sollicitudin vitae,0f57bb0a-3cd6-47ec-ad95-222222222222,ACTIVE,2017-12-15 04:15:01,2017-12-18 17:05:40
f5c21569-ba56-4e81-bd64-c651ba2d9da5,nec nisi vulputate nonummy maecenas tincidunt lacus at velit vivamus vel,0f57bb0a-3cd6-47ec-ad95-222222222222,ACTIVE,2017-12-04 22:49:41,2017-12-26 06:20:55
60c3101d-0cb1-40f0-9600-30891e330b4d,convallis nunc proin at turpis a pede posuere nonummy integer non velit donec diam neque vestibulum eget vulputate ut,0f57bb0a-3cd6-47ec-ad95-111111111111,ACTIVE,2017-12-07 05:36:22,2017-12-08 13:58:55
bc0fda1f-4f38-436d-9023-813612f21d6e,dolor sit amet consectetuer adipiscing elit proin risus praesent lectus vestibulum quam sapien varius ut blandit non interdum in,0f57bb0a-3cd6-47ec-ad95-222222222222,ACTIVE,2017-12-02 09:51:29,2017-12-28 01:20:08
3ebecca9-9dc0-426d-a1f2-28d316b2d6a9,tincidunt eu felis fusce posuere felis sed lacus morbi sem mauris laoreet ut rhoncus aliquet pulvinar sed nisl nunc rhoncus,0f57bb0a-3cd6-47ec-ad95-222222222222,ACTIVE,2017-12-12 03:13:45,2017-12-13 04:11:51
ccb2683f-96e8-4d7f-9606-74b210d192eb,magnis dis parturient montes nascetur ridiculus mus vivamus vestibulum sagittis sapien cum sociis,0f57bb0a-3cd6-47ec-ad95-111111111111,ACTIVE,2017-12-19 19:35:26,2017-12-18 05:04:22
a8a27604-9a47-402c-99d4-69ab8068bfce,augue quam sollicitudin vitae consectetuer eget rutrum at lorem integer tincidunt ante vel,0f57bb0a-3cd6-47ec-ad95-111111111111,ACTIVE,2017-12-12 22:02:51,2017-12-25 16:35:15
