transaction_id,detail,merchant_id,status,created_at,updated_at
c4574c90-eabe-4c86-8a27-c088f66e8711,magnis dis parturient montes nascetur ridiculus mus vivamus vestibulum sagittis sapien,0f57bb0a-3cd6-47ec-ad95-111111111111,ACTIVE,2017-12-28 16:17:06,2017-12-03 22:31:52
deae0e8d-66da-4b7d-9737-d5fac065949a,ut massa volutpat convallis morbi odio odio elementum eu interdum eu tincidunt in leo maecenas pulvinar lobortis est,0f57bb0a-3cd6-47ec-ad95-111111111111,ACTIVE,2017-12-19 18:14:13,2017-12-24 22:19:57
6693728c-e824-4eac-b6b8-21c82a710adf,pulvinar sed nisl nunc rhoncus dui vel sem sed sagittis nam congue risus semper porta volutpat,0f57bb0a-3cd6-47ec-ad95-111111111111,ACTIVE,2017-12-07 10:26:01,2017-12-21 06:54:09
c163a192-cc98-4e41-a535-c0b50b02dc6b,nullam orci pede venenatis non sodales sed tincidunt eu felis fusce posuere felis sed lacus morbi sem mauris laoreet ut,0f57bb0a-3cd6-47ec-ad95-111111111111,ACTIVE,2017-12-10 10:06:29,2017-12-01 13:37:10
0fc0bcf3-75f6-48b6-abd2-bd08b5ec4a34,amet lobortis sapien sapien non mi integer ac neque duis bibendum morbi non quam nec dui,0f57bb0a-3cd6-47ec-ad95-222222222222,ACTIVE,2017-12-01 07:02:45,2017-12-24 12:19:11
96b258e3-0489-4145-84ff-61e9fac1ba9d,luctus nec molestie sed justo pellentesque viverra pede ac diam,0f57bb0a-3cd6-47ec-ad95-222222222222,ACTIVE,2017-12-16 02:07:20,2017-12-02 19:57:19
70a8af06-2838-4a96-a696-58a7fd1ed672,lectus in quam fringilla rhoncus mauris enim leo rhoncus sed vestibulum sit,0f57bb0a-3cd6-47ec-ad95-222222222222,ACTIVE,2017-12-18 04:00:02,2017-12-07 15:48:36
186a7ca2-e0e2-46f0-bb12-e72b21d5bd05,nec dui luctus rutrum nulla tellus in sagittis dui vel,0f57bb0a-3cd6-47ec-ad95-111111111111,ACTIVE,2017-12-13 10:09:05,2017-12-26 19:19:23
608414f2-7211-4cb1-8920-7d8aee256695,nibh fusce lacus purus aliquet at feugiat non pretium quis lectus suspendisse potenti in eleifend,0f57bb0a-3cd6-47ec-ad95-111111111111,ACTIVE,2017-12-08 08:00:39,2017-12-10 19:07:34
8ca1a753-c549-4335-82b7-898f7b00062c,eu magna vulputate luctus cum sociis natoque penatibus et magnis dis parturient montes nascetur ridiculus,0f57bb0a-3cd6-47ec-ad95-222222222222,ACTIVE,2017-12-09 17:12:31,2017-12-04 21:28:42
f277ccbb-f7ea-44ac-b990-0a1f66e00140,ante ipsum primis in faucibus orci luctus et ultrices posuere cubilia curae donec,0f57bb0a-3cd6-47ec-ad95-111111111111,ACTIVE,2017-12-10 08:51:51,2017-12-10 19:40:57
6d6d88c8-9e46-423d-9120-753ee22701fc,ligula nec sem duis aliquam convallis nunc proin at turpis a pede posuere,0f57bb0a-3cd6-47ec-ad95-111111111111,ACTIVE,2017-12-21 12:15:44,2017-12-06 04:08:54
b6fce81d-8ed1-4ab8-831f-98349ac69099,vestibulum aliquet ultrices erat tortor sollicitudin mi sit amet lobortis sapien,0f57bb0a-3cd6-47ec-ad95-111111111111,ACTIVE,2017-12-08 10:02:49,2017-12-12 08:44:38
eaaa68a8-7144-4c34-a111-4531737ff0a7,morbi a ipsum integer a nibh in quis justo maecenas,0f57bb0a-3cd6-47ec-ad95-222222222222,ACTIVE,2017-12-19 09:38:27,2017-12-01 15:03:45
ca49ec35-9a6d-4027-a93c-9c05a909c46c,congue vivamus metus arcu adipiscing molestie hendrerit at vulputate vitae nisl aenean lectus pellentesque eget nunc donec,0f57bb0a-3cd6-47ec-ad95-111111111111,ACTIVE,2017-12-26 20:45:01,2017-12-26 08:16:39
2f993192-08af-4954-9090-7cd84f27c042,nulla elit ac nulla sed vel enim sit amet nunc viverra dapibus nulla suscipit ligula,0f57bb0a-3cd6-47ec-ad95-111111111111,ACTIVE,2017-12-03 16:47:19,2017-12-21 16:56:50
78874a73-f569-4bf3-b33e-bff791679d7f,justo morbi ut odio cras mi pede malesuada in imperdiet et commodo vulputate,0f57bb0a-3cd6-47ec-ad95-222222222222,ACTIVE,2017-12-09 12:07:53,2017-12-15 02:15:25
dd80d756-3aa0-4910-a1c1-c31e0cdc25ce,suscipit ligula in lacus curabitur at ipsum ac tellus semper interdum mauris ullamcorper purus,0f57bb0a-3cd6-47ec-ad95-222222222222,ACTIVE,2017-12-17 08:31:14,2017-12-03 22:52:35
13ddb62a-24c6-49cc-89bd-c82e9b29fda6,purus phasellus in felis donec semper sapien a libero nam dui proin leo,0f57bb0a-3cd6-47ec-ad95-222222222222,ACTIVE,2017-12-20 11:50:37,2017-12-20 17:01:51
fc768567-4d5f-4767-b344-7fe3ea6635cb,odio condimentum id luctus nec molestie sed justo pellentesque viverra pede ac,0f57bb0a-3cd6-47ec-ad95-111111111111,ACTIVE,2017-12-20 03:38:51,2017-12-15 19:04:59
5d23451a-8477-4a04-9f63-da0c151cb3aa,vivamus vel nulla eget eros elementum pellentesque quisque porta volutpat erat quisque erat eros viverra,0f57bb0a-3cd6-47ec-ad95-111111111111,ACTIVE,2017-12-27 23:19:30,2017-12-19 10:53:20
e6758c00-8a3e-4cf0-a943-9a1a00b0caae,viverra eget congue eget semper rutrum nulla nunc purus phasellus in felis donec semper sapien,0f57bb0a-3cd6-47ec-ad95-111111111111,ACTIVE,2017-12-03 06:34:57,2017-12-30 11:30:33
c1ac95da-1200-457d-a421-7292897c0521,nisl nunc nisl duis bibendum felis sed interdum venenatis turpis enim blandit mi in porttitor pede,0f57bb0a-3cd6-47ec-ad95-222222222222,ACTIVE,2017-12-10 03:42:28,2017-12-19 15:50:53
a7bc43ef-7bdb-47d7-9d42-22a320a8e2eb,ante vestibulum ante ipsum primis in faucibus orci luctus et ultrices posuere cubilia curae duis faucibus accumsan odio,0f57bb0a-3cd6-47ec-ad95-111111111111,ACTIVE,2017-12-03 10:32:24,2017-12-20 14:22:49
097ac2a8-249c-4d19-81c7-c14736dc1e30,curabitur convallis duis consequat dui nec nisi volutpat eleifend donec ut dolor morbi,0f57bb0a-3cd6-47ec-ad95-111111111111,ACTIVE,2017-12-01 09:12:54,2017-12-25 21:16:23
d958b7d0-13ba-4fdf-be21-483ad7e4cf73,eget eros elementum pellentesque quisque porta volutpat erat quisque erat eros viverra eget congue eget semper rutrum,0f57bb0a-3cd6-47ec-ad95-222222222222,ACTIVE,2017-12-10 18:38:48,2017-12-06 05:39:03
79e737fd-2155-4816-88e4-cfbb4124bb07,est quam pharetra magna ac consequat metus sapien ut nunc vestibulum ante ipsum,0f57bb0a-3cd6-47ec-ad95-111111111111,ACTIVE,2017-12-02 05:31:53,2017-12-06 23:39:39
e5a19e94-5e55-43a5-89e2-7bd4bcf42f67,vestibulum proin eu mi nulla ac enim in tempor turpis nec euismod scelerisque quam turpis adipiscing lorem vitae,0f57bb0a-3cd6-47ec-ad95-111111111111,ACTIVE,2017-12-22 03:21:38,2017-12-04 23:04:39
22a9c6c9-a8e6-4aa3-b9d4-420da456cd0e,pede ac diam cras pellentesque volutpat dui maecenas tristique est et tempus,0f57bb0a-3cd6-47ec-ad95-222222222222,ACTIVE,2017-12-06 07:15:50,2017-12-05 17:16:12
e33be617-2124-4d23-b000-5c5b57b26070,sed interdum venenatis turpis enim blandit mi in porttitor pede justo eu massa donec dapibus duis at,0f57bb0a-3cd6-47ec-ad95-222222222222,ACTIVE,2017-12-24 23:45:04,2017-12-25 03:31:41
883f02d4-d9ab-4e5f-a0c5-269d9bd1898f,sit amet cursus id turpis integer aliquet massa id lobortis convallis tortor risus dapibus augue vel accumsan tellus,0f57bb0a-3cd6-47ec-ad95-111111111111,ACTIVE,2017-12-24 22:45:11,2017-12-14 02:31:33
59469e3c-4cdd-47b1-9844-5321ac279c84,primis in faucibus orci luctus et ultrices posuere cubilia curae,0f57bb0a-3cd6-47ec-ad95-222222222222,ACTIVE,2017-12-13 06:44:13,2017-12-15 07:30:52
9dcd83f5-35db-4fb6-9e99-9fe5f2387f1b,sagittis nam congue risus semper porta volutpat quam pede lobortis ligula sit amet eleifend,0f57bb0a-3cd6-47ec-ad95-111111111111,ACTIVE,2017-12-05 07:11:58,2017-12-14 10:09:43
65ad6b95-668b-4665-8ed7-1cc41f5c23f9,ultricies eu nibh quisque id justo sit amet sapien dignissim vestibulum vestibulum,0f57bb0a-3cd6-47ec-ad95-111111111111,ACTIVE,2017-12-24 22:19:16,2017-12-04 17:45:44
3480f892-8be3-4c6f-a129-532837d84534,velit nec nisi vulputate nonummy maecenas tincidunt lacus at velit vivamus vel nulla eget eros elementum pellentesque quisque,0f57bb0a-3cd6-47ec-ad95-111111111111,ACTIVE,2017-12-20 11:30:27,2017-12-27 13:26:04
bcbf60aa-e3e8-4926-958d-50ecac518584,eget eleifend luctus ultricies eu nibh quisque id justo sit amet,0f57bb0a-3cd6-47ec-ad95-222222222222,ACTIVE,2017-12-04 16:01:59,2017-12-13 15:10:19
69c972a8-24e9-47f8-807a-614609a69558,erat volutpat in congue etiam justo etiam pretium iaculis justo in hac habitasse,0f57bb0a-3cd6-47ec-ad95-222222222222,ACTIVE,2017-12-11 07:47:06,2017-12-11 08:13:37
0d935b8d-2e16-4e28-981e-9c61ceb5e765,lobortis convallis tortor risus dapibus augue vel accumsan tellus nisi eu orci mauris lacinia,0f57bb0a-3cd6-47ec-ad95-111111111111,ACTIVE,2017-12-10 06:06:12,2017-12-19 16:03:28
bfd44e17-cd10-4df0-85cb-b26dd7c738eb,rutrum neque aenean auctor gravida sem praesent id massa id nisl venenatis lacinia aenean sit amet,0f57bb0a-3cd6-47ec-ad95-111111111111,ACTIVE,2017-12-08 18:47:49,2017-12-29 19:04:34
3ca738e1-66a1-4a68-9d75-b26efc55cbec,adipiscing elit proin risus praesent lectus vestibulum quam sapien varius ut blandit non interdum in ante vestibulum,0f57bb0a-3cd6-47ec-ad95-111111111111,ACTIVE,2017-12-07 21:33:07,2017-12-05 12:27:09
b0525d2a-6d52-4a83-9e7a-d572ac379c80,amet lobortis sapien sapien non mi integer ac neque duis bibendum morbi non quam nec dui luctus rutrum nulla tellus,0f57bb0a-3cd6-47ec-ad95-111111111111,ACTIVE,2017-12-07 22:15:59,2017-12-17 07:27:06
4c0555df-4657-4751-bca4-61e588ce3028,bibendum morbi non quam nec dui luctus rutrum nulla tellus in sagittis dui vel nisl,0f57bb0a-3cd6-47ec-ad95-222222222222,ACTIVE,2017-12-16 01:42:19,2017-12-09 03:13:16
352503b9-087a-4091-9c65-7c70e28708bf,felis donec semper sapien a libero nam dui proin leo odio porttitor id,0f57bb0a-3cd6-47ec-ad95-111111111111,ACTIVE,2017-12-24 05:41:01,2017-12-03 10:33:37
c3e040e8-9295-482d-bf4c-a71a71041289,est congue elementum in hac habitasse platea dictumst morbi vestibulum velit id pretium iaculis diam erat fermentum justo nec,0f57bb0a-3cd6-47ec-ad95-111111111111,ACTIVE,2017-12-13 22:44:10,2017-12-09 01:36:43
41f61992-7716-4ca0-8b67-fb56f94a37a7,felis sed interdum venenatis turpis enim blandit mi in porttitor pede justo eu massa donec dapibus duis,0f57bb0a-3cd6-47ec-ad95-222222222222,ACTIVE,2017-12-05 00:01:31,2017-12-04 12:10:26
81319482-a687-47d0-bbe9-2a8a7fe93de4,vestibulum quam sapien varius ut blandit non interdum in ante vestibulum ante ipsum primis in faucibus orci luctus et ultrices,0f57bb0a-3cd6-47ec-ad95-222222222222,ACTIVE,2017-12-09 05:37:54,2017-12-12 02:30:34
48089540-ba2e-4d30-aeeb-4152c339bf3a,ac nulla sed vel enim sit amet nunc viverra dapibus nulla suscipit ligula in,0f57bb0a-3cd6-47ec-ad95-222222222222,ACTIVE,2017-12-04 07:36:33,2017-12-25 10:11:50
4a0165c9-65db-4072-880f-2affd9008fe9,ut dolor morbi vel lectus in quam fringilla rhoncus mauris enim leo rhoncus sed vestibulum sit,0f57bb0a-3cd6-47ec-ad95-111111111111,ACTIVE,2017-12-14 20:41:59,2017-12-22 05:54:57
5f414792-ed50-473b-af62-66288ea458b6,etiam faucibus cursus urna ut tellus nulla ut erat id mauris vulputate elementum nullam varius nulla facilisi cras non velit,0f57bb0a-3cd6-47ec-ad95-111111111111,ACTIVE,2017-12-03 06:13:42,2017-12-20 11:27:51
9e165ac5-8f78-4dac-95d8-750910a0e142,dictumst aliquam augue quam sollicitudin vitae consectetuer eget rutrum at lorem integer tincidunt ante vel ipsum,0f57bb0a-3cd6-47ec-ad95-111111111111,ACTIVE,2017-12-16 16:54:26,2017-12-11 07:35:50
f266bff5-f774-4e71-821e-a76f6db227b3,eros elementum pellentesque quisque porta volutpat erat quisque erat eros viverra,0f57bb0a-3cd6-47ec-ad95-222222222222,ACTIVE,2017-12-24 00:24:05,2017-12-25 17:31:37
72afb846-dc04-432c-aef2-183f6d4ef757,viverra dapibus nulla suscipit ligula in lacus curabitur at ipsum ac tellus semper interdum mauris ullamcorper purus sit amet,0f57bb0a-3cd6-47ec-ad95-111111111111,ACTIVE,2017-12-16 00:45:52,2017-12-13 18:43:43
a8f3db0a-4c68-4dfd-9209-0690753461f9,nullam molestie nibh in lectus pellentesque at nulla suspendisse potenti cras in purus eu magna vulputate luctus cum sociis natoque,0f57bb0a-3cd6-47ec-ad95-222222222222,ACTIVE,2017-12-22 12:01:09,2017-12-17 06:25:52
6710ce62-c528-45e2-abd5-92024cc763bb,vulputate ut ultrices vel augue vestibulum ante ipsum primis in faucibus orci luctus et,0f57bb0a-3cd6-47ec-ad95-111111111111,ACTIVE,2017-12-01 06:05:51,2017-12-27 18:17:03
dca74339-089e-46cf-8007-9ffa2e240f53,sollicitudin vitae consectetuer eget rutrum at lorem integer tincidunt ante vel ipsum praesent blandit lacinia,0f57bb0a-3cd6-47ec-ad95-111111111111,ACTIVE,2017-12-09 08:30:01,2017-12-14 00:12:11
3ece41d7-151e-4bcc-8400-fb3bfabef7ab,lacus morbi quis tortor id nulla ultrices aliquet maecenas leo,0f57bb0a-3cd6-47ec-ad95-222222222222,ACTIVE,2017-12-23 17:24:34,2017-12-09 22:17:10
b5951694-5281-493d-9988-84c428373193,erat nulla tempus vivamus in felis eu sapien cursus vestibulum proin,0f57bb0a-3cd6-47ec-ad95-111111111111,ACTIVE,2017-12-11 23:19:26,2017-12-05 13:49:59
a7bb4548-9e2a-4593-931d-215b9dcd2e5d,et ultrices posuere cubilia curae donec pharetra magna vestibulum aliquet ultrices erat tortor sollicitudin mi sit amet lobortis sapien sapien,0f57bb0a-3cd6-47ec-ad95-222222222222,ACTIVE,2017-12-27 03:32:50,2017-12-26 22:30:06
44c37923-90d9-4147-b51c-f8285e4e6e24,ornare imperdiet sapien urna pretium nisl ut volutpat sapien arcu sed augue aliquam erat volutpat in congue etiam justo,0f57bb0a-3cd6-47ec-ad95-222222222222,ACTIVE,2017-12-22 20:41:21,2017-12-09 03:16:39
b30365bf-50c0-4afa-bc81-f656885114fa,nunc viverra dapibus nulla suscipit ligula in lacus curabitur at ipsum ac tellus semper,0f57bb0a-3cd6-47ec-ad95-111111111111,ACTIVE,2017-12-22 09:08:41,2017-12-26 03:23:12
66ec3ed8-19b1-40ce-9df6-331d58001dd5,in tempor turpis nec euismod scelerisque quam turpis adipiscing lorem vitae mattis nibh ligula,0f57bb0a-3cd6-47ec-ad95-222222222222,ACTIVE,2017-12-14 15:43:29,2017-12-22 21:27:01
31786918-8893-479e-b962-f785de2f26f9,aliquet maecenas leo odio condimentum id luctus nec molestie sed justo pellentesque viverra,0f57bb0a-3cd6-47ec-ad95-222222222222,ACTIVE,2017-12-19 21:37:27,2017-12-16 23:28:24
e1649bca-32e8-4f54-8cc9-9906144e7042,consectetuer adipiscing elit proin interdum mauris non ligula pellentesque ultrices phasellus id,0f57bb0a-3cd6-47ec-ad95-111111111111,ACTIVE,2017-12-29 05:16:10,2017-12-17 05:54:06
35156f8c-10ca-420d-b10c-934b4f6b330b,sit amet nunc viverra dapibus nulla suscipit ligula in lacus curabitur at ipsum ac tellus semper interdum mauris ullamcorper,0f57bb0a-3cd6-47ec-ad95-222222222222,ACTIVE,2017-12-13 07:12:21,2017-12-25 17:08:00
00ef4786-d2fe-4bff-9143-127480d2e543,nisi at nibh in hac habitasse platea dictumst aliquam augue quam sollicitudin vitae,0f57bb0a-3cd6-47ec-ad95-222222222222,ACTIVE,2017-12-27 11:09:08,2017-12-21 02:35:16
c4c70912-b708-4254-980e-a1d7455991d3,semper interdum mauris ullamcorper purus sit amet nulla quisque arcu libero,0f57bb0a-3cd6-47ec-ad95-222222222222,ACTIVE,2017-12-05 19:35:45,2017-12-12 05:08:56
6bc32e73-b30b-42eb-889a-df62c43fbf8a,habitasse platea dictumst maecenas ut massa quis augue luctus tincidunt nulla mollis molestie,0f57bb0a-3cd6-47ec-ad95-111111111111,ACTIVE,2017-12-22 07:58:18,2017-12-28 06:38:55
12453911-e979-4499-a6b4-79c7e8f18d47,placerat ante nulla justo aliquam quis turpis eget elit sodales scelerisque,0f57bb0a-3cd6-47ec-ad95-222222222222,ACTIVE,2017-12-07 20:57:35,2017-12-19 18:15:42
665e6894-d984-4a0b-84b4-e71fe9c51fd9,luctus cum sociis natoque penatibus et magnis dis parturient montes nascetur ridiculus mus vivamus vestibulum sagittis,0f57bb0a-3cd6-47ec-ad95-111111111111,ACTIVE,2017-12-09 15:33:22,2017-12-01 05:20:17
f1346458-f83b-4f88-8390-cf2be289bd72,etiam justo etiam pretium iaculis justo in hac habitasse platea dictumst etiam faucibus cursus,0f57bb0a-3cd6-47ec-ad95-222222222222,ACTIVE,2017-12-01 02:10:53,2017-12-25 03:26:48
bae7019d-9ff2-4027-add5-674123d1b280,mi pede malesuada in imperdiet et commodo vulputate justo in blandit ultrices enim lorem ipsum dolor,0f57bb0a-3cd6-47ec-ad95-111111111111,ACTIVE,2017-12-28 12:45:34,2017-12-03 07:02:29
4888551a-23e2-4575-966d-94883d7e4422,fusce posuere felis sed lacus morbi sem mauris laoreet ut rhoncus aliquet pulvinar sed nisl nunc rhoncus,0f57bb0a-3cd6-47ec-ad95-222222222222,ACTIVE,2017-12-29 19:11:15,2017-12-18 02:52:06
041c2560-abac-48ff-9477-a6704eb469cd,lectus suspendisse potenti in eleifend quam a odio in hac habitasse platea dictumst maecenas,0f57bb0a-3cd6-47ec-ad95-111111111111,ACTIVE,2017-12-12 22:46:38,2017-12-29 19:15:44
da6978d4-a854-42c0-9eae-4ab1c134b01b,in purus eu magna vulputate luctus cum sociis natoque penatibus et magnis dis parturient montes nascetur ridiculus mus vivamus,0f57bb0a-3cd6-47ec-ad95-111111111111,ACTIVE,2017-12-24 04:43:22,2017-12-03 10:47:29
253f01d6-1c17-4302-a8ca-820c37dbe956,posuere nonummy integer non velit donec diam neque vestibulum eget vulputate,0f57bb0a-3cd6-47ec-ad95-111111111111,ACTIVE,2017-12-06 07:59:13,2017-12-15 10:54:30
2988b125-881f-46cf-bf76-05ea680edfe3,nulla ut erat id mauris vulputate elementum nullam varius nulla facilisi cras,0f57bb0a-3cd6-47ec-ad95-222222222222,ACTIVE,2017-12-18 00:35:49,2017-12-20 09:18:33
739cdd76-a7f4-41d0-98d3-31ea50254837,duis ac nibh fusce lacus purus aliquet at feugiat non pretium quis lectus suspendisse potenti,0f57bb0a-3cd6-47ec-ad95-222222222222,ACTIVE,2017-12-25 18:12:17,2017-12-26 20:25:20
5e5f0610-ede2-43a2-828a-482e52521508,cubilia curae mauris viverra diam vitae quam suspendisse potenti nullam porttitor lacus at turpis donec,0f57bb0a-3cd6-47ec-ad95-222222222222,ACTIVE,2017-12-25 07:39:24,2017-12-04 22:20:50
6dffe91f-e2ae-421a-9e29-8fc5b2677616,posuere cubilia curae mauris viverra diam vitae quam suspendisse potenti nullam porttitor lacus at turpis donec,0f57bb0a-3cd6-47ec-ad95-111111111111,ACTIVE,2017-12-30 04:48:48,2017-12-07 15:27:52
c0995f5b-24e1-45d0-906a-8722eea4a0d4,lectus in quam fringilla rhoncus mauris enim leo rhoncus sed vestibulum sit amet cursus id turpis,0f57bb0a-3cd6-47ec-ad95-111111111111,ACTIVE,2017-12-15 08:46:25,2017-12-04 10:57:50
2aedae70-f2bf-4280-9394-47fad8bd6f41,vestibulum velit id pretium iaculis diam erat fermentum justo nec condimentum neque sapien placerat ante nulla justo aliquam quis,0f57bb0a-3cd6-47ec-ad95-111111111111,ACTIVE,2017-12-18 07:39:36,2017-12-06 15:27:32
be7e3814-c1e0-4cc3-a45b-ae957a52a9ca,nisl nunc rhoncus dui vel sem sed sagittis nam congue risus semper,0f57bb0a-3cd6-47ec-ad95-222222222222,ACTIVE,2017-12-05 02:36:45,2017-12-19 20:47:45
f0f0365d-e2b5-43fa-b2a0-49bf1ba997cd,nam nulla integer pede justo lacinia eget tincidunt eget tempus vel pede morbi porttitor,0f57bb0a-3cd6-47ec-ad95-222222222222,ACTIVE,2017-12-14 23:50:27,2017-12-25 06:47:10
415956cc-6f80-4bdf-8482-098173072b71,sodales scelerisque mauris sit amet eros suspendisse accumsan tortor quis turpis sed ante vivamus tortor duis mattis,0f57bb0a-3cd6-47ec-ad95-222222222222,ACTIVE,2017-12-23 12:40:39,2017-12-26 10:36:37
9fa45e86-c847-4154-bb3d-225f20d947be,libero convallis eget eleifend luctus ultricies eu nibh quisque id justo sit,0f57bb0a-3cd6-47ec-ad95-111111111111,ACTIVE,2017-12-29 13:47:54,2017-12-30 21:36:21
3bbda9f4-78c5-4b0d-bae4-12060fb2f27a,et ultrices posuere cubilia curae donec pharetra magna vestibulum aliquet ultrices erat tortor sollicitudin mi,0f57bb0a-3cd6-47ec-ad95-111111111111,ACTIVE,2017-12-23 21:58:17,2017-12-25 22:34:50
56b9a144-d3df-4027-b1a1-2b045e68d7c8,orci luctus et ultrices posuere cubilia curae mauris viverra diam vitae quam suspendisse potenti nullam porttitor lacus at turpis,0f57bb0a-3cd6-47ec-ad95-222222222222,ACTIVE,2017-12-06 21:47:41,2017-12-29 10:59:06
00ed6836-9deb-4656-ae19-aa316209e63c,semper porta volutpat quam pede lobortis ligula sit amet eleifend pede libero quis orci nullam molestie nibh in,0f57bb0a-3cd6-47ec-ad95-222222222222,ACTIVE,2017-12-02 19:36:24,2017-12-24 05:35:38
68d43745-c2ab-4dad-8a1f-08f6ac1a2acb,porta volutpat erat quisque erat eros viverra eget congue eget semper rutrum nulla nunc purus phasellus in felis,0f57bb0a-3cd6-47ec-ad95-111111111111,ACTIVE,2017-12-09 14:16:46,2017-12-03 21:59:27
8774bbb4-6b89-4c12-a3e2-9dacf6d1889e,ultrices posuere cubilia curae nulla dapibus dolor vel est donec odio justo sollicitudin ut suscipit a feugiat,0f57bb0a-3cd6-47ec-ad95-111111111111,ACTIVE,2017-12-27 04:56:15,2017-12-07 10:52:49
54eae60c-d247-415f-9fcb-ef2c7eb08e6c,id massa id nisl venenatis lacinia aenean sit amet justo morbi ut odio cras mi pede malesuada in imperdiet,0f57bb0a-3cd6-47ec-ad95-222222222222,ACTIVE,2017-12-25 00:34:34,2017-12-09 00:50:35
b1a72e61-4ffb-4805-b940-057d016f3134,auctor gravida sem praesent id massa id nisl venenatis lacinia aenean sit amet justo morbi ut odio cras,0f57bb0a-3cd6-47ec-ad95-222222222222,ACTIVE,2017-12-28 23:40:56,2017-12-01 01:29:09
2fa7918d-c03f-4bd0-abd5-0a6ea655eaea,augue luctus tincidunt nulla mollis molestie lorem quisque ut erat curabitur gravida nisi at nibh in hac habitasse platea dictumst,0f57bb0a-3cd6-47ec-ad95-222222222222,ACTIVE,2017-12-26 18:15:20,2017-12-22 11:24:13
625ebca5-172e-4d1a-98ad-f9ba07ed1a73,eget eros elementum pellentesque quisque porta volutpat erat quisque erat eros,0f57bb0a-3cd6-47ec-ad95-111111111111,ACTIVE,2017-12-22 17:09:15,2017-12-25 01:06:35
77fff6f8-b8a4-44fe-b566-012b4e14bf4d,semper est quam pharetra magna ac consequat metus sapien ut nunc vestibulum ante ipsum primis,0f57bb0a-3cd6-47ec-ad95-222222222222,ACTIVE,2017-12-28 05:05:59,2017-12-14 07:03:29
688ae227-18e3-45b1-a253-8e441e1612ce,elit sodales scelerisque mauris sit amet eros suspendisse accumsan tortor quis turpis sed ante vivamus,0f57bb0a-3cd6-47ec-ad95-111111111111,ACTIVE,2017-12-25 12:56:52,2017-12-29 19:04:25
d05e5b2b-f1f8-437b-a05c-f8af5d5d00d3,vel pede morbi porttitor lorem id ligula suspendisse ornare consequat lectus in est risus auctor sed tristique in tempus sit,0f57bb0a-3cd6-47ec-ad95-111111111111,ACTIVE,2017-12-17 00:46:58,2017-12-08 03:11:08
06bfdfa8-d7ff-4f9e-bdc3-b6b89d2a6a96,ultrices posuere cubilia curae mauris viverra diam vitae quam suspendisse potenti nullam porttitor,0f57bb0a-3cd6-47ec-ad95-111111111111,ACTIVE,2017-12-15 12:42:10,2017-12-23 22:05:11
f5c626f8-7a71-4843-a20e-50acdfd1808f,orci mauris lacinia sapien quis libero nullam sit amet turpis elementum ligula vehicula consequat,0f57bb0a-3cd6-47ec-ad95-111111111111,ACTIVE,2017-12-06 10:20:36,2017-12-07 23:37:04
01dc35fc-dfa8-4277-96f6-c4410fc457f5,eros elementum pellentesque quisque porta volutpat erat quisque erat eros viverra eget congue eget semper,0f57bb0a-3cd6-47ec-ad95-222222222222,ACTIVE,2017-12-20 22:59:14,2017-12-04 17:00:19
77fe0b5d-fcbb-4f88-976b-4a716e67614d,amet sem fusce consequat nulla nisl nunc nisl duis bibendum felis sed interdum venenatis turpis enim blandit mi in porttitor,0f57bb0a-3cd6-47ec-ad95-111111111111,ACTIVE,2017-12-28 03:51:08,2017-12-20 13:31:14
2f08bca5-6112-482f-ab2f-153f765356c7,eros vestibulum ac est lacinia nisi venenatis tristique fusce congue diam id ornare imperdiet sapien urna pretium nisl,0f57bb0a-3cd6-47ec-ad95-111111111111,ACTIVE,2017-12-08 12:09:03,2017-12-05 03:08:22
fb6866c1-80c1-4c41-a8cf-2f53cf1787a6,sapien in sapien iaculis congue vivamus metus arcu adipiscing molestie hendrerit,0f57bb0a-3cd6-47ec-ad95-222222222222,ACTIVE,2017-12-01 16:44:58,2017-12-09 12:27:15
77c71790-ec55-404b-b4bb-35d134c1dfd9,vestibulum rutrum rutrum neque aenean auctor gravida sem praesent id massa id nisl venenatis lacinia aenean sit amet,0f57bb0a-3cd6-47ec-ad95-111111111111,ACTIVE,2017-12-04 13:36:29,2017-12-26 16:21:55
476b6464-067c-4018-b5ca-ef5a5d83cab6,nulla suspendisse potenti cras in purus eu magna vulputate luctus,0f57bb0a-3cd6-47ec-ad95-111111111111,ACTIVE,2017-12-10 22:12:21,2017-12-13 01:40:42
3603bbcd-879e-4d29-9eb0-5d59e79b91f1,cubilia curae duis faucibus accumsan odio curabitur convallis duis consequat dui nec nisi volutpat eleifend donec ut dolor morbi vel,0f57bb0a-3cd6-47ec-ad95-111111111111,ACTIVE,2017-12-04 05:12:53,2017-12-11 06:39:06
f451e340-682a-4d1f-9da7-eac72fa72acd,justo sollicitudin ut suscipit a feugiat et eros vestibulum ac,0f57bb0a-3cd6-47ec-ad95-222222222222,ACTIVE,2017-12-01 00:48:44,2017-12-07 21:10:45
208ba3ff-8462-4b0a-8c82-9e678aed894c,eu interdum eu tincidunt in leo maecenas pulvinar lobortis est phasellus sit amet erat nulla tempus,0f57bb0a-3cd6-47ec-ad95-111111111111,ACTIVE,2017-12-01 03:21:40,2017-12-12 02:33:44
d2cbe8c4-5e8c-4e7d-8126-a5620f14b4ba,pellentesque ultrices mattis odio donec vitae nisi nam ultrices libero non mattis pulvinar nulla pede ullamcorper augue a suscipit nulla,0f57bb0a-3cd6-47ec-ad95-111111111111,ACTIVE,2017-12-17 08:27:38,2017-12-07 14:37:10
2a0ce8ee-0454-4150-89c1-8627ba603f74,vitae mattis nibh ligula nec sem duis aliquam convallis nunc proin at turpis a pede posuere,0f57bb0a-3cd6-47ec-ad95-222222222222,ACTIVE,2017-12-27 23:21:35,2017-12-07 15:54:34
8430feec-b5bd-471b-b5b0-85f21fb30a43,ante ipsum primis in faucibus orci luctus et ultrices posuere,0f57bb0a-3cd6-47ec-ad95-111111111111,ACTIVE,2017-12-08 01:57:09,2017-12-03 20:26:28
39ae11b4-ce4c-4cfc-95f4-51006e25ad03,odio odio elementum eu interdum eu tincidunt in leo maecenas,0f57bb0a-3cd6-47ec-ad95-111111111111,ACTIVE,2017-12-28 02:52:15,2017-12-06 01:52:48
394aa63c-c765-445e-8913-957e93db9a6e,neque aenean auctor gravida sem praesent id massa id nisl venenatis lacinia aenean sit amet justo morbi ut,0f57bb0a-3cd6-47ec-ad95-222222222222,ACTIVE,2017-12-06 02:35:47,2017-12-18 09:53:58
0f3a7fa5-b0a3-4a10-a343-238c8b39a0cc,nulla sed accumsan felis ut at dolor quis odio consequat varius integer ac leo pellentesque ultrices mattis odio donec vitae,0f57bb0a-3cd6-47ec-ad95-222222222222,ACTIVE,2017-12-27 20:18:11,2017-12-22 20:57:39
04239439-d5fd-4653-b5ef-f1654d571417,neque duis bibendum morbi non quam nec dui luctus rutrum nulla tellus in sagittis dui vel,0f57bb0a-3cd6-47ec-ad95-111111111111,ACTIVE,2017-12-14 03:53:51,2017-12-09 13:58:53
1432c43a-0cca-4ddc-9ca3-e58315d55442,sapien ut nunc vestibulum ante ipsum primis in faucibus orci luctus et ultrices posuere,0f57bb0a-3cd6-47ec-ad95-222222222222,ACTIVE,2017-12-03 23:02:19,2017-12-04 08:03:12
dba88f5b-4eee-430f-b75d-a65255f9d02d,pharetra magna ac consequat metus sapien ut nunc vestibulum ante ipsum primis in faucibus orci luctus,0f57bb0a-3cd6-47ec-ad95-222222222222,ACTIVE,2017-12-08 02:30:02,2017-12-19 05:33:10
